id,created_at,url,Titles
1.65749E+17,2012-02-04T10:49:48.000Z,http://t.co/c2cljb2v,Syria activist: Homs situation 'so bad'
1.65726E+17,2012-02-04T09:20:29.000Z,http://t.co/c2Zzg2Ug,Arrests at Syrian embassy protest
1.65694E+17,2012-02-04T07:11:46.000Z,http://t.co/lvzBTy4R,"Afghan civilian deaths rise for fifth year, says UN"
1.65588E+17,2012-02-04T00:12:10.000Z,http://t.co/0ISlqPVD,Wikileaks suspect Bradley Manning to face court martial
1.65472E+17,2012-02-03T16:30:34.000Z,http://t.co/h34lzwQW,Apple overturns Motorola's iPad and iPhone sales bans
1.65467E+17,2012-02-03T16:08:06.000Z,http://t.co/HVeK9Z70,Iran accused of intimidating BBC Persian staff
1.65462E+17,2012-02-03T15:47:58.000Z,http://t.co/Dz4OiqDH,Russia 'cannot support' UN Syria draft resolution
1.65453E+17,2012-02-03T15:13:34.000Z,http://t.co/PYhsi1dJ,Anonymous gain access to FBI and Scotland Yard hacking call
1.65432E+17,2012-02-03T13:52:07.000Z,http://t.co/8ui5iGqC,As it happened: Chris Huhne resigns ministerial post over speeding case charges
1.65378E+17,2012-02-03T10:17:40.000Z,http://t.co/AY3alxPP,Profile: Chris Huhne
1.65376E+17,2012-02-03T10:06:46.000Z,http://t.co/r4vwxNfO,Chris Huhne quits cabinet over speeding claims charge
1.65357E+17,2012-02-03T08:50:57.000Z,http://t.co/X6qHZRx1,Britons die after contracting Legionnaires' disease in Spain
1.65289E+17,2012-02-03T04:22:10.000Z,http://t.co/6kFO4Vbk,Life term for Cambodia Khmer Rouge jailer Duch
1.65254E+17,2012-02-03T02:01:44.000Z,http://t.co/TNzk3EJj,Deaths in Egypt's Suez after Port Said football unrest
1.65224E+17,2012-02-03T00:02:51.000Z,http://t.co/157gX6md,Russia threatens UN veto over Syria resolution
1.65206E+17,2012-02-02T22:51:49.000Z,http://t.co/ifeHs9oA,UN Syria text drops call for Assad power handover
1.65175E+17,2012-02-02T20:48:16.000Z,http://t.co/RQd1V9In,Donald Trump endorses Mitt Romney in Las Vegas
1.65085E+17,2012-02-02T14:52:21.000Z,http://t.co/KDsgLtsF,Harry Redknapp admits lying to News of the World
1.65084E+17,2012-02-02T14:46:10.000Z,http://t.co/urYy7UIY,CPS to announce decision in Huhne case
1.6505E+17,2012-02-02T12:33:58.000Z,http://t.co/Qxi4Jw8u,Times 'investigated for email hacking'
1.65045E+17,2012-02-02T12:13:15.000Z,http://t.co/27lhgvJ0,Egypt football riot: Port Said officials sacked
1.65039E+17,2012-02-02T11:48:51.000Z,http://t.co/Dc2PyckD,Student Loans chief 'to pay tax at source'
1.65019E+17,2012-02-02T10:30:25.000Z,http://t.co/Lo6pouY3,Immigrants 'must add to quality of life in Britain'
1.65017E+17,2012-02-02T10:21:53.000Z,http://t.co/Tx4SAqXd,Undercover police officer Mark Kennedy 'defied' bosses
1.65007E+17,2012-02-02T09:42:27.000Z,http://t.co/3zNUjBCb,"AstraZeneca to cut a further 7,300 jobs"
1.64988E+17,2012-02-02T08:26:39.000Z,http://t.co/KK7xagF5,Xstrata and Glencore in talks over 'merger of equals'
1.64988E+17,2012-02-02T08:24:35.000Z,http://t.co/XFZtHbAu,Philippine military 'kills three wanted militants'
1.64834E+17,2012-02-01T22:14:12.000Z,http://t.co/jZKbqKyh,Facebook unveils $5bn stock market flotation plans
1.64806E+17,2012-02-01T20:21:38.000Z,http://t.co/3OrYlHYO,Egypt football violence leaves many dead in Port Said
1.64803E+17,2012-02-01T20:12:29.000Z,http://t.co/HOQr7Bmp,MPs reverse Lords welfare defeats
1.64758E+17,2012-02-01T17:13:39.000Z,http://t.co/8KeZxLxT,Fatal shooting near Turnpike Lane Tube station
1.64743E+17,2012-02-01T16:12:50.000Z,http://t.co/rFP418aL,Soul Train creator Don Cornelius kills himself
1.64741E+17,2012-02-01T16:06:12.000Z,http://t.co/pVuQJHCQ,Rival Libya militias battle in Tripoli
1.64736E+17,2012-02-01T15:46:43.000Z,http://t.co/gdPImPxA,Stephen Lawrence: Attorney General to review sentences
1.64688E+17,2012-02-01T12:33:41.000Z,http://t.co/00CuIZG0,Phone hacking: IT 'deleted Murdoch hacking email'
1.64667E+17,2012-02-01T11:11:35.000Z,http://t.co/gZv8Vkqx,John Terry faces Anton Ferdinand racism trial after Euro finals
1.64662E+17,2012-02-01T10:50:14.000Z,http://t.co/NHJW0acN,Assange appeals 'invalid' warrant at Supreme Court
1.64662E+17,2012-02-01T10:49:13.000Z,http://t.co/cmMQXBVc,Pakistan helping Afghan Taliban - Nato
1.64661E+17,2012-02-01T10:45:44.000Z,http://t.co/x7fWfM8y,London Stock Exchange bomb plot admitted by four men
1.64656E+17,2012-02-01T10:26:09.000Z,http://t.co/kvtKAeeq,Stansted sale: BAA loses appeal against ruling
1.64533E+17,2012-02-01T02:16:39.000Z,http://t.co/YTp7krjD,Florida primary 2012: As it happened
1.64516E+17,2012-02-01T01:09:29.000Z,http://t.co/doJ6ydYl,Mitt Romney scores big Florida primary win
1.64409E+17,2012-01-31T18:05:27.000Z,http://t.co/omOe0rmh,Former RBS boss Fred Goodwin stripped of knighthood
1.64393E+17,2012-01-31T17:03:07.000Z,http://t.co/Xbc4CH3U,Committee to re-examine Sir Fred Goodwin's knighthood
1.64332E+17,2012-01-31T12:58:38.000Z,http://t.co/3cR41j1h,Canterbury pond body: Murder suspect arrested
1.64242E+17,2012-01-31T07:03:33.000Z,http://t.co/2G9KxAYW,Water bills in England and Wales to rise 5.7% in April
1.64166E+17,2012-01-31T02:01:17.000Z,http://t.co/nulZpPW2,Queen needs Prince Philip at her side - Prince Harry
1.64035E+17,2012-01-30T17:17:57.000Z,http://t.co/lmStl4Ci,Stephen Lawrence killers to launch appeal
1.64012E+17,2012-01-30T15:48:46.000Z,http://t.co/5VnETxdZ,Gary Speed narrative verdict after wife tells inquest of marriage strain
1.63928E+17,2012-01-30T10:14:27.000Z,http://t.co/ERkzERbd,Home Secretary Theresa May on police reforms
1.63913E+17,2012-01-30T09:13:11.000Z,http://t.co/PGSuaVpz,Salford homes evacuated after police find devices
1.63903E+17,2012-01-30T08:34:36.000Z,http://t.co/PT13TDMb,Strong earthquake hits Peru's central coastline
1.63897E+17,2012-01-30T08:11:46.000Z,http://t.co/kBZeCVUt,Syrian army returns to Damascus suburbs
1.63687E+17,2012-01-29T18:15:49.000Z,http://t.co/mDivih4H,Duncan Smith: RBS bonus veto would have caused chaos
1.63639E+17,2012-01-29T15:04:39.000Z,http://t.co/ijeaQ8jM,Iraqi bloc ends parliament boycott over Hashemi warrant
1.63541E+17,2012-01-29T08:36:22.000Z,http://t.co/VuAzY7PJ,Syria condemns Arab League move to suspend monitoring
1.63358E+17,2012-01-28T20:29:25.000Z,http://t.co/mUMEcU61,UK soldier killed in Afghanistan named by MoD
1.6324E+17,2012-01-28T12:41:00.000Z,http://t.co/Z3hEcMnD,Operation Elveden: Five bailed in police payment probe
1.63233E+17,2012-01-28T12:11:57.000Z,http://t.co/YAxkb1Co,RBS chairman rejects £1.4m bonus
1.63231E+17,2012-01-28T12:02:43.000Z,http://t.co/ie7Ik6MF,Pakistan v England second Test day four as it happened
1.63201E+17,2012-01-28T10:04:25.000Z,http://t.co/YGgivVzq,Maria Sharapova v Victoria Azarenka Australian Open 2010 as it happened
1.63152E+17,2012-01-28T06:50:38.000Z,http://t.co/soXjpy14,Group of GPs warns of 'peril' if NHS changes fail
1.63148E+17,2012-01-28T06:32:56.000Z,http://t.co/HKmmzJ6B,Libya prisoners make new torture allegations
1.63144E+17,2012-01-28T06:19:27.000Z,http://t.co/AJ775bd3,Hospital escape prisoner Andrew Farndon arrested
1.63049E+17,2012-01-28T00:02:48.000Z,http://t.co/OVJ0aXfG,Archbishop urges state not to 'dictate' over marriage
1.63029E+17,2012-01-27T22:42:15.000Z,http://t.co/EOduzf74,Syria crisis: UN Security Council mulls Assad measures
1.62877E+17,2012-01-27T12:38:55.000Z,http://t.co/nlLuryY2,Rio building collapse: Dust cloud caught on film
1.62853E+17,2012-01-27T11:03:28.000Z,http://t.co/UF0QKUPZ,"RBS chief Stephen Hester's £963,000 bonus criticised"
1.62827E+17,2012-01-27T09:20:21.000Z,http://t.co/lijJFRAJ,Car bomb attack near funeral in Baghdad kills 32 people
1.62816E+17,2012-01-27T08:34:29.000Z,http://t.co/rgRYmCWw,Spain's unemployment total passes five million
1.62784E+17,2012-01-27T06:28:58.000Z,http://t.co/mk9Hh0yE,Government escapes rebellion by medics over NHS
1.62743E+17,2012-01-27T03:44:08.000Z,http://t.co/LRtRSvUC,Guatemala ex-leader Rios Montt to face genocide charge
1.62726E+17,2012-01-27T02:38:15.000Z,http://t.co/oSaj0qQx,Republican presidential candidates spar in TV debate
1.62709E+17,2012-01-27T01:30:14.000Z,http://t.co/WQ5SVNVL,Cocaine seized at UN headquarters in New York
1.62694E+17,2012-01-27T00:29:04.000Z,http://t.co/Pu3G0jgQ,Autism: Brainwaves 'show risk from age of six months'
1.62693E+17,2012-01-27T00:27:58.000Z,http://t.co/2Z1eYsNb,PIP breast implant boss Jean-Claude Mas faces charges
1.62664E+17,2012-01-26T22:32:40.000Z,http://t.co/APMNrOZJ,Six dead after Rio de Janeiro building collapse
1.62621E+17,2012-01-26T19:40:39.000Z,http://t.co/bXKvBvcD,"US to cut almost 100,000 troops"
1.62619E+17,2012-01-26T19:33:17.000Z,http://t.co/WJugMKpS,"RBS chief Stephen Hester to get £963,000 bonus"
1.62608E+17,2012-01-26T18:48:51.000Z,http://t.co/P7RiNEZN,Goodluck Jonathan in challenge to Boko Haram
1.6253E+17,2012-01-26T13:39:54.000Z,http://t.co/AZsqbmBz,Rio de Janeiro building collapse rescue continues
1.62486E+17,2012-01-26T10:43:54.000Z,http://t.co/o8pIKCXF,Davos 2012
1.62469E+17,2012-01-26T09:36:51.000Z,http://t.co/8JFMFeTT,Two men arrested over Stockport burnt headless body
1.62265E+17,2012-01-25T20:06:43.000Z,http://t.co/AwwORE4d,Welfare bill suffers Lords defeat over child support
1.62263E+17,2012-01-25T19:56:58.000Z,http://t.co/z3rD65YW,Afghan death soldier named as Signaller Ian Sartorius-Jones
1.62214E+17,2012-01-25T16:44:07.000Z,http://t.co/bT8pMfyZ,Angela Merkel opens WEF at Davos
1.62199E+17,2012-01-25T15:45:15.000Z,http://t.co/YHYt4yZ9,Syria crisis: Red Crescent official in Idlib shot dead
1.62199E+17,2012-01-25T15:44:17.000Z,http://t.co/BQo7Rer7,David Cameron on reform of European Court of Human Rights
1.62168E+17,2012-01-25T13:40:02.000Z,http://t.co/oVi8Swbz,As-it-happened: Scottish government referendum statement
1.62126E+17,2012-01-25T10:54:20.000Z,http://t.co/XuIUHDgJ,Somalia: Western hostages freed in US military raid
1.62112E+17,2012-01-25T09:56:41.000Z,http://t.co/1xHY9vw3,UK economy shrinks by 0.2% in last three months of 2011
1.62057E+17,2012-01-25T06:20:07.000Z,http://t.co/WuOUcdOF,Somalia country profile
1.62009E+17,2012-01-25T03:09:29.000Z,http://t.co/dsW3A5gy,As it happened: State of the Union
1.61827E+17,2012-01-24T15:05:34.000Z,http://t.co/n00UjVJR,IMF: Global economy 'in danger zone' over euro crisis
1.6181E+17,2012-01-24T13:56:50.000Z,http://t.co/8DbYSOYT,"Oscars: Hugo has 11 nominations, The Artist has 10"
1.61802E+17,2012-01-24T13:26:12.000Z,http://t.co/rPOMOfKb,Oscar nominations: Live BBC coverage
1.61728E+17,2012-01-24T08:31:58.000Z,http://t.co/4EaMaO8Y,Iraq unrest: Car bombs rock Baghdad Shia districts
1.61534E+17,2012-01-23T19:41:10.000Z,http://t.co/lhYwn5hX,Iran: EU oil sanctions 'unfair' and 'doomed to fail'
1.61529E+17,2012-01-23T19:21:37.000Z,http://t.co/XTyXR1pn,John Beeley death at Stepping Hill Hospital probed
1.61526E+17,2012-01-23T19:10:29.000Z,http://t.co/WCYvMpr6,Government suffers Lords defeat over benefit cap plan
1.61525E+17,2012-01-23T19:04:34.000Z,http://t.co/69IusVSZ,Mario Balotelli: Manchester City will not appeal against ban
1.61463E+17,2012-01-23T14:59:18.000Z,http://t.co/ccBBvaSB,Harry Redknapp 'avoided tax on bungs'
1.61463E+17,2012-01-23T14:57:28.000Z,http://t.co/81HFMdKp,Costa Concordia: Bodies found as fuel pumping to start
1.61445E+17,2012-01-23T13:46:03.000Z,http://t.co/DrWhzTQj,"Businessman Asil Nadir stole nearly £150m, court hears"
1.61429E+17,2012-01-23T12:45:11.000Z,http://t.co/flBpdeKQ,Juror Theodora Dallas jailed for contempt of court
1.61353E+17,2012-01-23T07:42:07.000Z,http://t.co/QtXmktnN,Stepping Hill saline inquiry: Further death probed
1.61146E+17,2012-01-22T18:00:03.000Z,http://t.co/1If7dFTA,Yemen's President Saleh 'leaves country' for treatment
1.61127E+17,2012-01-22T16:44:15.000Z,http://t.co/1dfYUna7,Syria unrest: Saudis pull out of Arab League mission
1.61104E+17,2012-01-22T15:13:40.000Z,http://t.co/BDANGoX1,Costa Concordia disaster: Eight dead identified
1.6075E+17,2012-01-21T15:45:14.000Z,http://t.co/R3ZZ5pDp,Nigeria violence: Scores dead after Kano blasts
1.6074E+17,2012-01-21T15:06:14.000Z,http://t.co/aWC3lnWP,Costa Concordia disaster
1.60625E+17,2012-01-21T07:30:31.000Z,http://t.co/p81Xp6uS,Help for Pakistan shooting widow Rubana Mukhtar
1.60461E+17,2012-01-20T20:36:41.000Z,http://t.co/ApEkD0LC,Three babies dead after infection at Belfast hospital
1.60451E+17,2012-01-20T19:59:27.000Z,http://t.co/i4ldLgOG,Nigeria's Kano rocked by multiple explosions
1.60439E+17,2012-01-20T19:09:50.000Z,http://t.co/GVTCk8Mp,Costa Concordia disaster: Cruise firm faces US lawsuit
1.60426E+17,2012-01-20T18:19:56.000Z,http://t.co/sZ3vICvK,Benefits cap not about punishing people - Duncan Smith
1.60403E+17,2012-01-20T16:48:02.000Z,http://t.co/ur3xK1tf,Etta James: Soul legend dies in California
1.60383E+17,2012-01-20T15:26:33.000Z,http://t.co/7OV1I4ZT,Italy cruise ship: Safety on board the Costa Serena
1.60355E+17,2012-01-20T13:37:37.000Z,http://t.co/hMdsY7jm,HMV gets breathing space from banks
1.60353E+17,2012-01-20T13:28:05.000Z,http://t.co/RMVt4Bbx,Brian Shivers guilty of Massereene soldiers' killings
1.60345E+17,2012-01-20T12:58:02.000Z,http://t.co/rjb1cLE6,"A380 wings to be checked for cracks, EASA says"
1.60332E+17,2012-01-20T12:06:55.000Z,http://t.co/O2cY1KGN,Firefighter warehouse deaths: Warwickshire council admits safety lapse
1.60319E+17,2012-01-20T11:11:26.000Z,http://t.co/MJtoPpGK,Sunday Times drops Chris Huhne emails legal challenge
1.60231E+17,2012-01-20T05:22:06.000Z,http://t.co/eRJMY2Mc,Migrants on work-related benefits study published
1.60165E+17,2012-01-20T00:59:44.000Z,http://t.co/T40h8PLJ,General Motors reclaims world's top vehicle-maker slot
1.60112E+17,2012-01-19T21:29:01.000Z,http://t.co/M54T9YAR,Security tight after two bombs explode in Londonderry
1.60092E+17,2012-01-19T20:12:03.000Z,http://t.co/7DPX18tX,Israel arrests senior Palestinian Aziz Dweik
1.60071E+17,2012-01-19T18:48:19.000Z,http://t.co/SZ0Zaw0M,Pakistan kidnap: Two foreigners seized in Multan
1.60042E+17,2012-01-19T16:51:57.000Z,http://t.co/l7YVrplU,Leap second decision is postponed
1.59971E+17,2012-01-19T12:10:02.000Z,http://t.co/6pnLp85J,Live - Wales manager announcement
1.5996E+17,2012-01-19T11:25:15.000Z,http://t.co/034h7ZlV,"Phone hacking: Jude Law, Lord Prescott and Sara Payne get payouts"
1.59938E+17,2012-01-19T10:01:23.000Z,http://t.co/RJgpOgSs,Afghan suicide attack kills seven at Kandahar airport
1.59916E+17,2012-01-19T08:31:26.000Z,http://t.co/HqQxMk9N,Costa Concordia: Captain Schettino 'turned too late'
1.5988E+17,2012-01-19T06:10:45.000Z,http://t.co/klhhxvbs,Pakistan PM Gilani stands firm in contempt battle
1.59787E+17,2012-01-18T23:58:14.000Z,http://t.co/NFYN2zQ3,David Beckham extends LA Galaxy stay with two-year deal
1.59677E+17,2012-01-18T16:41:40.000Z,http://t.co/33WzjwwS,Afghanistan blasts kill 13 in Helmand province
1.59662E+17,2012-01-18T15:41:11.000Z,http://t.co/lSBjGkuf,Welshpool air crash: Two die as light aircraft comes down at Long Mountain
1.5963E+17,2012-01-18T13:37:06.000Z,http://t.co/4yfGntp4,Costa Concordia: Satellite image
1.59616E+17,2012-01-18T12:38:02.000Z,http://t.co/cbqCIJkI,As it happened: PM's Questions
1.59604E+17,2012-01-18T11:52:09.000Z,http://t.co/7rf3LZBU,"Organisers unveil 1,000-boat Diamond Jubilee flotilla"
1.59547E+17,2012-01-18T08:03:59.000Z,http://t.co/7FbsmkaQ,Ethiopia gunmen kill five foreign tourists in Afar
1.59501E+17,2012-01-18T05:03:32.000Z,http://t.co/jcxZL9GO,Wikipedia joins blackout protest at US anti-piracy moves
1.59407E+17,2012-01-17T22:51:09.000Z,http://t.co/bLa2GoKe,Concordia disaster: House arrest for Captain Schettino
1.59352E+17,2012-01-17T19:11:58.000Z,http://t.co/q9MvAoVD,Concordia disaster: Five bodies found in cruise wreck
1.59279E+17,2012-01-17T14:20:43.000Z,http://t.co/ppdbspNj,Recording reveals coastguard told captain to 'get back on board'
1.59208E+17,2012-01-17T09:37:41.000Z,http://t.co/SzMwflm1,UK inflation rate falls to 4.2% in December
1.59183E+17,2012-01-17T07:59:01.000Z,http://t.co/KKGn7L9H,Costa Concordia disaster: Rescuers blast holes in search for missing
1.59102E+17,2012-01-17T02:38:43.000Z,http://t.co/zs3dfY3S,China's economic growth slows to 8.9% in fourth quarter
1.59032E+17,2012-01-16T22:00:13.000Z,http://t.co/Ys7MledL,Costa Concordia cruise ship captain 'went off course'
1.58977E+17,2012-01-16T18:21:41.000Z,http://t.co/jkyBGIK2,Royal yacht idea considered by Cameron
1.58949E+17,2012-01-16T16:29:14.000Z,http://t.co/VGgaFJMz,Republican primaries: Jon Huntsman to end bid
1.58907E+17,2012-01-16T13:43:39.000Z,http://t.co/3GmBBGE7,Cruise ship news conference held in Italy
1.58878E+17,2012-01-16T11:47:26.000Z,http://t.co/iEs6CJPf,"New yacht for Queen's jubilee, suggests Michael Gove"
1.58862E+17,2012-01-16T10:44:38.000Z,http://t.co/nEf5NB6Y,"Cruise captain 'committed errors', say ship's owners"
1.58861E+17,2012-01-16T10:40:26.000Z,http://t.co/SZoV2Bl0,Costa Concordia: What happened
1.58773E+17,2012-01-16T04:49:03.000Z,http://t.co/136BLyXB,Courts adopt burglary sentencing guidelines
1.58569E+17,2012-01-15T15:18:48.000Z,http://t.co/ySKg33GL,Costa Concordia: Italy cruise ship survivors found
1.5855E+17,2012-01-15T14:04:49.000Z,http://t.co/M2rENsIX,Costa Concordia's captain: 'Rocks not detected'
1.5825E+17,2012-01-14T18:13:12.000Z,http://t.co/C8ylNYAM,Italy cruise ship Costa Concordia: Search for missing
1.58205E+17,2012-01-14T15:14:38.000Z,http://t.co/qo2W8cry,Italy cruise ship Costa Concordia aground near Giglio
1.58156E+17,2012-01-14T11:59:52.000Z,http://t.co/bdRNh9uu,Mohamed ElBaradei will end Egypt presidency bid
1.58139E+17,2012-01-14T10:51:02.000Z,http://t.co/TRBPTHAK,Iraq suicide bomb kills 50 in Basra pilgrims attack
1.58135E+17,2012-01-14T10:32:58.000Z,http://t.co/dZSBDLSi,Capsized Costa Concordia ship near island of Giglio
1.57946E+17,2012-01-13T22:04:19.000Z,http://t.co/E5bzgujg,France loses AAA rating as euro governments downgraded
1.57861E+17,2012-01-13T16:26:07.000Z,http://t.co/C5wWEK69,Burma frees high-profile dissidents in amnesty
1.57848E+17,2012-01-13T15:35:08.000Z,http://t.co/FqsDmvXA,Easyjet loses disability discrimination case in France
1.57735E+17,2012-01-13T08:03:53.000Z,http://t.co/Z7NtDRVC,Q&A: Renewed instability in Pakistan
1.57721E+17,2012-01-13T07:11:27.000Z,http://t.co/GKTC65y4,"Birmingham murders: £10,000 reward offered"
1.57547E+17,2012-01-12T19:36:44.000Z,http://t.co/m22iskxD,US 'deplores' US Marines Taliban 'urination' video
1.57519E+17,2012-01-12T17:48:10.000Z,http://t.co/c9qw9EhR,Duchess of York faces charges over Turkish orphan film
1.57494E+17,2012-01-12T16:09:17.000Z,http://t.co/IaxOcDTP,Policeman who found murdered parents is 'coping well'
1.57464E+17,2012-01-12T14:09:55.000Z,http://t.co/5RjCRbos,Nigeria fuel strikes: Your stories
1.57433E+17,2012-01-12T12:03:42.000Z,http://t.co/Gu8SMjEz,UK interest rates kept on hold at record low of 0.5%
1.57419E+17,2012-01-12T11:09:56.000Z,http://t.co/jNW6mXsh,British Gas and SSE announce price cuts
1.57401E+17,2012-01-12T09:57:00.000Z,http://t.co/HlhGkB5z,Ulster Bank says 950 jobs to go on island of Ireland
1.57368E+17,2012-01-12T07:48:19.000Z,http://t.co/cVoSCQPW,North Korea to display Kim Jong-il's body permanently
1.57363E+17,2012-01-12T07:28:13.000Z,http://t.co/7LcuJQce,US Marine Corps probes 'Taliban desecration' video
1.57361E+17,2012-01-12T07:17:36.000Z,http://t.co/VJ4ejMI2,Tesco 'disappointed' by its UK Christmas trading
1.57359E+17,2012-01-12T07:13:03.000Z,http://t.co/Pr4UwjMT,"RBS to cut 3,500 jobs in investment bank shake-up"
1.57359E+17,2012-01-12T07:10:17.000Z,http://t.co/oaXVHDQK,MSPs back Holyrood referendum move
1.57327E+17,2012-01-12T05:04:59.000Z,http://t.co/AJ03j8MH,Welfare Bill: Changes to continue despite Lords defeats
1.57323E+17,2012-01-12T04:49:13.000Z,http://t.co/RWTIKPn4,Libya rendition claims to be investigated by UK police
1.57307E+17,2012-01-12T03:44:06.000Z,http://t.co/Ad0DY9JD,Mississippi judge blocks release of 21 pardoned inmates
1.57294E+17,2012-01-12T02:53:36.000Z,http://t.co/He3dLqvY,Japan 'to reduce Iran oil imports'
1.57164E+17,2012-01-11T18:15:30.000Z,http://t.co/0A0zknVF,Syria unrest: French journalist Gilles Jacquier killed
1.57142E+17,2012-01-11T16:47:40.000Z,http://t.co/QRxnhSoM,German prosecutor shot dead in Bavarian court
1.57132E+17,2012-01-11T16:10:54.000Z,http://t.co/4fExCP8R,Birmingham murders: Husband and wife found by son
1.57128E+17,2012-01-11T15:54:09.000Z,http://t.co/9t30fQDM,Ex-Arab League monitor labels Syria mission 'a farce'
1.57074E+17,2012-01-11T12:18:57.000Z,http://t.co/gsxYeaeY,Pakistan army warns PM Gilani over criticisms
1.57041E+17,2012-01-11T10:06:40.000Z,http://t.co/sQ40Xd8L,Iran car explosion kills nuclear scientist in Tehran
1.57005E+17,2012-01-11T07:43:12.000Z,http://t.co/tKVEbbpI,EDF Energy to cut gas price by 5%
1.56911E+17,2012-01-11T01:30:35.000Z,http://t.co/Vp3CUg4S,As it happened: New Hampshire
1.56896E+17,2012-01-11T00:30:56.000Z,http://t.co/GIyTR5xa,New Hampshire primary: Republicans scramble for votes
1.56855E+17,2012-01-10T21:50:03.000Z,http://t.co/yXWieAHH,Indonesia quake triggers brief tsunami alert
1.568E+17,2012-01-10T18:08:58.000Z,http://t.co/99wfTjt5,Report: Independence referendum statement
1.56711E+17,2012-01-10T12:18:20.000Z,http://t.co/mJCApy3A,Ed Miliband speech on UK economy
1.5668E+17,2012-01-10T10:12:17.000Z,http://t.co/XBIeZFtk,Syria's Bashar al-Assad blames 'foreign conspiracy'
1.56672E+17,2012-01-10T09:40:38.000Z,http://t.co/olS0LCOm,HS2: High-speed rail network gets go-ahead
1.56668E+17,2012-01-10T09:25:44.000Z,http://t.co/OGfkJp48,Syria's President Bashar al-Assad makes rare address
1.5663E+17,2012-01-10T06:53:41.000Z,http://t.co/sb9ia7Zo,"Deadly blast hits bus terminal in Khyber, Pakistan"
1.56596E+17,2012-01-10T04:41:21.000Z,http://t.co/KPN0pdzY,North Korea announces prisoner amnesty
1.56584E+17,2012-01-10T03:51:01.000Z,http://t.co/QYDBiUf5,Mitt Romney under attack on eve of New Hampshire primary
1.56537E+17,2012-01-10T00:43:42.000Z,http://t.co/RN2NlLDl,Salmond calls for independence referendum in 2014
1.56534E+17,2012-01-10T00:31:12.000Z,http://t.co/gEn8nO5G,"UK recession is not yet inevitable, survey says"
1.5645E+17,2012-01-09T18:59:11.000Z,http://t.co/Tmp7RMgw,Monday 9 January
1.5643E+17,2012-01-09T17:38:03.000Z,http://t.co/gCK0N9BE,Iran enriching uranium at Fordo plant near Qom
1.56373E+17,2012-01-09T13:53:56.000Z,http://t.co/mZHS34t4,Ferry company SeaFrance to shed 127 Dover jobs
1.56348E+17,2012-01-09T12:15:58.000Z,http://t.co/6fBgb0oI,Antony Worrall Thompson 'sorry' for Tesco shoplifting
1.56303E+17,2012-01-09T09:15:15.000Z,http://t.co/hZLpOJDw,Iran death sentence for 'CIA spy' Amir Mirzai Hekmati
1.56174E+17,2012-01-09T00:42:59.000Z,http://t.co/EjTpSUvL,Stepping Hill Hospital saline inquiry: Nurse bailed
1.56009E+17,2012-01-08T13:46:52.000Z,http://t.co/dV9ACu6C,Murder probe over remains at Queen's Sandringham Estate
1.55953E+17,2012-01-08T10:05:36.000Z,http://t.co/WXKREzm7,Cameron promises powers to limit executives' pay
1.5595E+17,2012-01-08T09:53:20.000Z,http://t.co/xnLyuUYv,Cameron on The Andrew Marr Show
1.55798E+17,2012-01-07T23:49:13.000Z,http://t.co/Yfu3RgKG,Stepping Hill Hospital inquiry: Nurse quizzed on deaths
1.55788E+17,2012-01-07T23:07:08.000Z,http://t.co/CHDWLJqs,Man arrested over alleged abuse of Oldham footballer Tom Adeyemi
1.55668E+17,2012-01-07T15:13:51.000Z,http://t.co/fpNWbtJZ,Britons warned over Nairobi terror threat
1.55613E+17,2012-01-07T11:32:05.000Z,http://t.co/CYTqdcT2,Sudan's Bashir offers help to Libya during criticised visit
1.55556E+17,2012-01-07T07:48:19.000Z,http://t.co/otAEWtzc,HS2: High-speed rail link 'being seriously considered'
1.55471E+17,2012-01-07T02:07:32.000Z,http://t.co/GuiPUD7y,Nigeria Christians hit by fresh Islamist attacks
1.55434E+17,2012-01-06T23:43:33.000Z,http://t.co/Orh8pBHx,Eleven dead in New Zealand hot air balloon crash
1.55418E+17,2012-01-06T22:38:05.000Z,http://t.co/oVQyU4aV,Wayne Rooney: Manchester United deny plans to sell player
1.55356E+17,2012-01-06T18:32:55.000Z,http://t.co/vOz5vDBI,Clinics 'should offer to remove PIP breast implants'
1.55335E+17,2012-01-06T17:08:51.000Z,http://t.co/ubr9c5fl,PIP breast implants: review to give findings
1.55253E+17,2012-01-06T11:42:19.000Z,http://t.co/LU7NXD6J,"Phone hacking: Brooks's ex-PA arrested, BBC understands"
1.55245E+17,2012-01-06T11:09:15.000Z,http://t.co/dwVlzlM4,Syria unrest: Damascus blast and clashes kill many
1.55242E+17,2012-01-06T10:58:27.000Z,http://t.co/2PtIfmmH,Anuj Bidve shooting: Parents visit Salford scene
1.55201E+17,2012-01-06T08:14:25.000Z,http://t.co/M3RZvncy,Brain function can start declining 'as early as age 45'
1.55188E+17,2012-01-06T07:23:25.000Z,http://t.co/XOFqfOZE,Michael Kiwanuka
1.55047E+17,2012-01-05T22:06:10.000Z,http://t.co/Ahp2zy6E,Nigeria church hit by deadly gun attack in Gombe
1.55036E+17,2012-01-05T21:20:11.000Z,http://t.co/zSvHL14x,Strong winds cause disruption around UK
1.54976E+17,2012-01-05T17:20:45.000Z,http://t.co/fQlL6v1I,Stepping Hill Hospital saline inquiry: Nurse arrested
1.5496E+17,2012-01-05T16:19:39.000Z,http://t.co/GGtfoQXh,Your Pensions
1.5496E+17,2012-01-05T16:17:39.000Z,http://t.co/DucUoJAC,Pentagon military review 'will axe US troops'
1.54928E+17,2012-01-05T14:12:01.000Z,http://t.co/YJb5dWvy,Stephen Lawrence inquiry: Police 'planned to disband team'
1.54908E+17,2012-01-05T12:50:05.000Z,http://t.co/ss4HPb9i,Iraq: Bombings in Baghdad and Nasiriya kill scores
1.54894E+17,2012-01-05T11:54:25.000Z,http://t.co/1N9ozwK6,MP Diane Abbott 'sorry' over Twitter race comments
1.54879E+17,2012-01-05T10:58:41.000Z,http://t.co/q3Sd6p1B,Suu Kyi foresees democratic Burma
1.54862E+17,2012-01-05T09:49:18.000Z,http://t.co/vqzuqWXg,William Hague: Burma to free more 'political prisoners'
1.54716E+17,2012-01-05T00:07:34.000Z,http://t.co/RbbQpW8V,Duchess of Cambridge announces charity patronages
1.54632E+17,2012-01-04T18:35:48.000Z,http://t.co/7ThP73Qu,Stephen Lawrence: Gary Dobson and David Norris get life
