id,created_at,url,Titles
5.84659E+17,2015-04-05T10:07:27.000Z,http://t.co/KoJu5O0E20,Kenya mourns victims of Garissa al-Shabab attack
5.84637E+17,2015-04-05T08:40:42.000Z,http://t.co/wQYwsHz3i5,Large Hadron Collider restarts after two-year rebuild
5.84283E+17,2015-04-04T09:14:58.000Z,http://t.co/5K3Nzm5X7v,Kenya al-Shabab: Five in custody after Garissa massacre
5.84073E+17,2015-04-03T19:18:58.000Z,http://t.co/IDVqOtWkuS,Six terror arrests at Dover port
5.84043E+17,2015-04-03T17:20:17.000Z,http://t.co/kBSD9GyHCm,Kenya al-Shabab attack: Security questions as dead mourned
5.83995E+17,2015-04-03T14:10:39.000Z,http://t.co/YfyM6tTG0g,Iran nuclear talks: Hardliners criticise nuclear deal
5.83927E+17,2015-04-03T09:41:47.000Z,http://t.co/WY3m3w5MVS,Germanwings crash: Co-pilot Lubitz 'researched suicide'
5.83704E+17,2015-04-02T18:55:40.000Z,http://t.co/UYqkj26Y9N,Kenya attack: 147 dead in Garissa University assault
5.83694E+17,2015-04-02T18:15:58.000Z,http://t.co/nSF0xMnSFg,Iran nuclear talks: 'Framework' deal agreed
5.83686E+17,2015-04-02T17:42:27.000Z,http://t.co/xhSYpUVc72,LIVE: Statement following Iran nuclear deal conclusion
5.83682E+17,2015-04-02T17:25:02.000Z,http://t.co/oa89oc16EW,Alderney surgery raid follows four deaths
5.83675E+17,2015-04-02T17:00:26.000Z,http://t.co/Snx9gcJGlW,Syria border arrests: Seized Briton is son of councillor
5.83669E+17,2015-04-02T16:34:59.000Z,http://t.co/sR5rMn8VxY,"New York women inspired by IS plotted bombing, FBI says"
5.83664E+17,2015-04-02T16:16:57.000Z,http://t.co/zqUrN9Lj1E,Africa Live: Thursday 2 April 2015 as it happened
5.83635E+17,2015-04-02T14:21:31.000Z,http://t.co/IALq3gUlTG,EuroMillions couple from Boston tell of £53m win
5.83579E+17,2015-04-02T10:39:28.000Z,http://t.co/nE4E0y3zju,Yemen crisis: Rebels storm presidential palace in Aden
5.83575E+17,2015-04-02T10:22:49.000Z,http://t.co/KRg9Xnr65I,BBC Local Live: Updates from north-east England on Thursday 2 April 2015
5.83539E+17,2015-04-02T07:57:08.000Z,http://t.co/8e5x9W8v8H,Kenya Garissa students taken hostage by al-Shabab
5.83445E+17,2015-04-02T01:45:29.000Z,http://t.co/bGuw3HeW4K,Russian trawler sinks off Kamchatka with 56 dead
5.83335E+17,2015-04-01T18:29:03.000Z,http://t.co/AknGE9UuxT,California governor orders first ever water restrictions
5.83314E+17,2015-04-01T17:02:57.000Z,http://t.co/lGUEwRaqqL,Nine Britons held on Turkey-Syria border
5.83296E+17,2015-04-01T15:53:08.000Z,http://t.co/KDDGgsUogP,Fetcham murder: Viktoras Bruzas jailed for life
5.83288E+17,2015-04-01T15:22:12.000Z,http://t.co/amRptzAbPL,Gun attack on Istanbul police HQ in spate of violence
5.83286E+17,2015-04-01T15:13:06.000Z,http://t.co/moAqLTG3yN,BBC Local Live: Updates from London on Wednesday 1 April 2015
5.83278E+17,2015-04-01T14:42:21.000Z,http://t.co/myedw8fnE0,Thai military government replaces martial law
5.83278E+17,2015-04-01T14:41:31.000Z,http://t.co/3zLZYRza54,Operation Elveden: Milly Dowler leak policeman jailed
5.83265E+17,2015-04-01T13:50:18.000Z,http://t.co/QzCGsRCnD8,Africa Live: Wednesday 1 April 2015 as it happened
5.8326E+17,2015-04-01T13:27:56.000Z,http://t.co/Hrik2Lehei,Erol Incedal: Jailed for 42 months over bomb-making manual
5.83255E+17,2015-04-01T13:09:45.000Z,http://t.co/X5YjMwRH9L,IS militants 'enter Yarmouk refugee camp' in Syrian capital
5.8319E+17,2015-04-01T08:53:42.000Z,http://t.co/2MplP0A75r,Turkey prosecutor's funeral draws large crowd
5.83132E+17,2015-04-01T05:01:09.000Z,http://t.co/NlqZcO7i8H,Hamas leader Meshaal warns of Israeli 'extremism' after elections
5.82976E+17,2015-03-31T18:39:29.000Z,http://t.co/6cyAOhybbt,Bloody end to Turkey prosecutor hostage crisis
5.82954E+17,2015-03-31T17:15:00.000Z,http://t.co/FhsDb1S3Gh,Germanwings crash: Lufthansa knew of co-pilot depression
5.82949E+17,2015-03-31T16:53:19.000Z,http://t.co/LPbSLD9grK,Nigeria election: Muhammadu Buhari wins presidency
5.82922E+17,2015-03-31T15:08:41.000Z,http://t.co/DrNbv4PNmN,Ashcroft quits the House of Lords
5.82834E+17,2015-03-31T09:18:07.000Z,http://t.co/EWHQyVu8HF,LIVE: Plaid Cymru launches election manifesto
5.8279E+17,2015-03-31T06:20:38.000Z,http://t.co/uPIeqTXC2j,Business live: 31 March 2015
5.82732E+17,2015-03-31T02:30:02.000Z,http://t.co/O5O125jB0E,Borneo UK student killings: Local man convicted of murder
5.82544E+17,2015-03-30T14:06:32.000Z,http://t.co/YooD1Pz7FI,NSA shooting: One dead after car rams security gate
5.82534E+17,2015-03-30T13:25:38.000Z,http://t.co/SelRBF7jeh,Alps crash: Lubitz 'had treatment for suicidal tendencies'
5.82521E+17,2015-03-30T12:32:35.000Z,http://t.co/cWsf5GsDPJ,Africa Live: Monday 30 March 2015 as it happened
5.82519E+17,2015-03-30T12:24:09.000Z,http://t.co/Y9b0pNDoJL,Police probe after UK couple shot dead in Spain
5.82497E+17,2015-03-30T10:56:49.000Z,http://t.co/nONLSRJTdO,Election Live
5.82415E+17,2015-03-30T05:33:52.000Z,http://t.co/CEEaYkpiGA,Solar Impulse plane lands in China
5.82245E+17,2015-03-29T18:17:49.000Z,http://t.co/K6J8C8ax5O,French local elections: Exit polls suggest conservative win
5.82125E+17,2015-03-29T10:18:41.000Z,http://t.co/I9kEEe1zyK,Arab League agrees to create joint military force
5.82122E+17,2015-03-29T10:07:56.000Z,http://t.co/UU7OX5rDoI,Relive how Australia won the World Cup
5.81837E+17,2015-03-28T15:16:40.000Z,http://t.co/JxRimtmDKH,"Nigeria decides between Jonathan and Buhari: As it happened, Saturday 28 March 2015"
5.81822E+17,2015-03-28T14:14:03.000Z,http://t.co/GOiP75YoRj,Syria crisis: Idlib 'captured by Islamist groups'
5.81769E+17,2015-03-28T10:43:57.000Z,http://t.co/t7baWn7B4Y,Police officer Otis Goldsmith arrested over wife murder
5.81587E+17,2015-03-27T22:40:12.000Z,http://t.co/KF4i0JDz3O,Amanda Knox and Raffaele Sollecito acquitted of Meredith Kercher murder
5.81476E+17,2015-03-27T15:22:40.000Z,http://t.co/6xBkZ1T48P,"As it happened: Germanwings crash investigation, 27 March 2015"
5.81465E+17,2015-03-27T14:38:54.000Z,http://t.co/jQRNObesoL,Somalia hotel rocked by bomb and gunfight in Mogadishu
5.81457E+17,2015-03-27T14:04:12.000Z,http://t.co/2jxCqxK6eU,Operation Elveden: Court quashes reporter's conviction
5.81455E+17,2015-03-27T13:56:18.000Z,http://t.co/C1uNFPn9vt,British medic declared free of Ebola
5.81435E+17,2015-03-27T12:36:07.000Z,http://t.co/1y3KhlpfoP,Business live: 27 March 2015
5.81424E+17,2015-03-27T11:54:17.000Z,http://t.co/EBITw9eQmj,Catholic priest Anthony McSweeney jailed for sex abuse
5.81421E+17,2015-03-27T11:41:42.000Z,http://t.co/Rz6w6eKsba,Germanwings crash: Co-pilot Lubitz 'hid illness'
5.81414E+17,2015-03-27T11:14:48.000Z,http://t.co/FZWMeBwLhm,Boko Haram HQ Gwoza in Nigeria 'retaken'
5.81405E+17,2015-03-27T10:37:51.000Z,http://t.co/WGjb7CKKRM,Met Police sex abuse 'cover-up' inquiry extended
5.81401E+17,2015-03-27T10:23:09.000Z,http://t.co/7W9xyl4wNK,Business
5.814E+17,2015-03-27T10:18:48.000Z,http://t.co/CvXSvVfhgB,Top Gear producer 'won't press charges' against Jeremy Clarkson
5.81186E+17,2015-03-26T20:09:02.000Z,http://t.co/0rxWaC5QWv,New York buildings collapse after explosion in Manhattan
5.81168E+17,2015-03-26T18:58:46.000Z,http://t.co/EaOaKXTDXZ,Alps plane crash: What happened?
5.81153E+17,2015-03-26T17:57:57.000Z,http://t.co/OxdYPZeTcS,Politics Live: 27 March
5.81142E+17,2015-03-26T17:15:10.000Z,http://t.co/lZy6KtB3Tx,Airlines across the world to change safety policies
5.81117E+17,2015-03-26T15:35:01.000Z,http://t.co/KPeEe6gZL1,Germanwings crash latest updates
5.81063E+17,2015-03-26T11:58:09.000Z,http://t.co/OnOg0eFQAT,Germanwings plane crash: Co-pilot 'wanted to destroy plane'
5.81058E+17,2015-03-26T11:38:22.000Z,http://t.co/XnCgrXrzyj,Germanwings plane crash: Pilot 'locked out of cockpit'
5.81042E+17,2015-03-26T10:36:51.000Z,http://t.co/vPp4OTjxV0,Erol Incedal: Student cleared of planning terror attack
5.81037E+17,2015-03-26T10:14:43.000Z,http://t.co/BZxCWYojA8,UK to give military training to 'moderate Syria forces'
5.81036E+17,2015-03-26T10:11:35.000Z,http://t.co/55hQt4FJ2m,Rachel Treweek to become the new Bishop of Gloucester
5.81032E+17,2015-03-26T09:55:49.000Z,http://t.co/lioTwB920W,Prince Charles letters to be released after Supreme Court ruling
5.80976E+17,2015-03-26T06:12:57.000Z,http://t.co/zkOzROUqbr,Saudi Arabia launches air strikes in Yemen
5.80801E+17,2015-03-25T18:40:16.000Z,http://t.co/2jaS4VRDnu,Alps plane crash: Search Day Two
5.80795E+17,2015-03-25T18:15:22.000Z,http://t.co/vEOzwU61HX,Taliban-swap US soldier Bowe Bergdahl charged with desertion
5.8077E+17,2015-03-25T16:34:43.000Z,http://t.co/G54S2E7Yuw,As it happened: Jeremy Clarkson reaction
5.80753E+17,2015-03-25T15:26:58.000Z,http://t.co/ql81ig3IL1,"Jeremy Clarkson dropped from Top Gear, BBC confirms"
5.80704E+17,2015-03-25T12:14:04.000Z,http://t.co/zXNXKvVeIK,Campaign countdown: 25 March
5.80702E+17,2015-03-25T12:06:47.000Z,http://t.co/Osg69ng6vJ,Penrose inquiry: David Cameron apologises over infected blood
5.80691E+17,2015-03-25T11:22:16.000Z,http://t.co/LKI0JKjHmI,Ukraine arrests two top officials at cabinet meeting
5.80676E+17,2015-03-25T10:21:44.000Z,http://t.co/0aMSQcrqPg,Business live: 25 March 2015
5.80495E+17,2015-03-24T22:21:11.000Z,http://t.co/dv0X5PFmuv,Germanwings plane 4U 9525 crashes in French Alps - no survivors
5.8045E+17,2015-03-24T19:25:15.000Z,http://t.co/sLQEgD3111,As it happened: Germanwings Airbus A320 crash in France
5.80439E+17,2015-03-24T18:38:33.000Z,http://t.co/xvGAz6fJl2,Claudia Lawrence: Police bail murder suspect
5.80408E+17,2015-03-24T16:37:40.000Z,http://t.co/QsIKhPHSSu,Mark Duggan 'was throwing gun away' when shot by police
5.80309E+17,2015-03-24T10:04:24.000Z,http://t.co/lmFHjXuc1f,On the Runs scheme 'damaged integrity of criminal justice'
5.80301E+17,2015-03-24T09:30:24.000Z,http://t.co/s1vHMGVuJl,Business live: 24 March 2015
5.803E+17,2015-03-24T09:26:55.000Z,http://t.co/lIZ33pvx2j,Tunisia attack: Bardo museum reopening delayed to Sunday
5.80069E+17,2015-03-23T18:08:12.000Z,http://t.co/3FTFGKDFEj,David Cameron 'won't serve third term' if re-elected
5.80064E+17,2015-03-23T17:50:27.000Z,http://t.co/FN8rL5mwNl,Netanyahu apologises to Israeli-Arabs over election remarks
5.8002E+17,2015-03-23T14:55:24.000Z,http://t.co/RFZ5LqNQoD,Neil Fox charged with sex assaults
5.80004E+17,2015-03-23T13:52:44.000Z,http://t.co/r6Oba1BDj6,Claudia Lawrence: Murder arrest over missing York chef
5.79953E+17,2015-03-23T10:28:16.000Z,http://t.co/JPv37WgqAt,SA convicts ex-tennis doubles star Bob Hewitt of rape
5.79866E+17,2015-03-23T04:42:31.000Z,http://t.co/Hw3jShfo5B,Republican Senator Ted Cruz confirms US presidency bid
5.79781E+17,2015-03-22T23:04:27.000Z,http://t.co/Y4u2BJW1qN,Singapore's founding father Lee Kuan Yew dies at 91
5.79777E+17,2015-03-22T22:48:52.000Z,http://t.co/7U97z2Myuh,Lee Kuan Yew: Life in pictures
5.79771E+17,2015-03-22T22:25:40.000Z,http://t.co/WO4lRTRMpC,Top Gear Live shows postponed - BBC
5.79697E+17,2015-03-22T17:33:10.000Z,http://t.co/XxXLSpiiZ5,Tory candidate Afzal Amin denies 'fake EDL march' claim
5.79661E+17,2015-03-22T15:09:11.000Z,http://t.co/g7UpZiyTum,Syria helicopter crashes in rebel-held Idlib
5.79579E+17,2015-03-22T09:43:30.000Z,http://t.co/Dhli8iBIwp,Third Tunis Bardo Museum attacker 'on the run'
5.79563E+17,2015-03-22T08:40:13.000Z,http://t.co/1dBy5XfdOO,Yemeni city Taiz 'seized by Shia rebels'
5.79553E+17,2015-03-22T08:01:22.000Z,http://t.co/SslqMoiBn1,"Singer-songwriter Jackie Trent dies, aged 74"
5.79408E+17,2015-03-21T22:21:29.000Z,http://t.co/14ZCfueylT,Knife-wielding New Orleans airport attacker dies
5.79357E+17,2015-03-21T19:00:24.000Z,http://t.co/yYm1CHZnS4,Six Nations title race as it happened
5.79297E+17,2015-03-21T15:01:56.000Z,http://t.co/Gcx2zEZ6M7,Election debates agreement reached
5.79222E+17,2015-03-21T10:03:31.000Z,http://t.co/f6X8zw03EC,"Iran nuclear talks: Deal can be reached, says Rouhani"
5.78969E+17,2015-03-20T17:19:55.000Z,http://t.co/XFzJW2W9Nh,Business Live: 20 March 2015
5.78966E+17,2015-03-20T17:05:48.000Z,http://t.co/cIKx0p3iu4,Syria fears prompt travel ban on five teenage girls
5.78928E+17,2015-03-20T14:35:39.000Z,http://t.co/IDLwpKwT3t,Yemen crisis: More than 100 die in attacks on Sanaa mosques
5.78901E+17,2015-03-20T12:48:35.000Z,http://t.co/uDOOx9B73l,More than 260 charged in online child abuse operation
5.78885E+17,2015-03-20T11:45:00.000Z,http://t.co/MqeoTujIAq,Soldier beheading plan teenager Brusthom Ziamani jailed
5.78884E+17,2015-03-20T11:39:34.000Z,http://t.co/ZYaYFoVzOh,Sun journalists cleared in payments trial
5.78879E+17,2015-03-20T11:20:33.000Z,http://t.co/WMfqaYanvu,Supreme Court to rule on publication of Prince Charles letters
5.78855E+17,2015-03-20T09:44:44.000Z,http://t.co/1AibfIn866,Solar eclipse
5.78768E+17,2015-03-20T04:01:47.000Z,http://t.co/ZIjQ8NaGbs,Nigeria leader: Boko Haram 'getting weaker'
5.78761E+17,2015-03-20T03:32:35.000Z,http://t.co/pjLu7n0kSk,Thein Sein: Myanmar army to continue key transition role
5.7863E+17,2015-03-19T18:50:52.000Z,http://t.co/798D3baNGM,Illegal immigrants smuggled out of UK and back again
5.78629E+17,2015-03-19T18:47:22.000Z,http://t.co/7YyhsDasmw,Campaign countdown: 19 March
5.7859E+17,2015-03-19T16:11:40.000Z,http://t.co/Q9Nmbs4yHD,Jeremy Clarkson Top Gear 'fracas' report due next week
5.78577E+17,2015-03-19T15:19:31.000Z,http://t.co/f8hzbcBd06,Tunis Bardo museum: Nine suspects arrested for links to attack
5.78549E+17,2015-03-19T13:29:05.000Z,http://t.co/D92fFhOrQW,Yemen crisis: Air raid on president's palace in Aden
5.78535E+17,2015-03-19T12:34:22.000Z,http://t.co/8G3hXfTAhW,Woman in Luton Airport terror arrest after Turkey flight
5.78507E+17,2015-03-19T10:44:06.000Z,http://t.co/Xqhrx4fEQW,Tunis museum attack: Briton killed in shootings named as Sally Adey
5.78257E+17,2015-03-18T18:08:48.000Z,http://t.co/UoLQDcH3H8,Federal Reserve modifies stance on low interest rates
5.78244E+17,2015-03-18T17:16:19.000Z,http://t.co/DHgs0RERPW,Israel election: US concern over 'divisive' rhetoric
5.7821E+17,2015-03-18T15:04:08.000Z,http://t.co/Y8Q2ueFWK0,As it happened: Tunisia attack
5.78206E+17,2015-03-18T14:46:06.000Z,http://t.co/mt5cQnXqG3,Budget 2015: As it happened
5.78192E+17,2015-03-18T13:50:18.000Z,http://t.co/feSKMV4DJM,Key points of Budget 2015: At-a-glance
5.78173E+17,2015-03-18T12:35:16.000Z,http://t.co/NyaxzFQvP9,Tunis attack: Gunmen kill tourists in museum rampage
5.78118E+17,2015-03-18T08:59:04.000Z,http://t.co/VVgijXhkzj,Germany riot targets new ECB headquarters in Frankfurt
5.78097E+17,2015-03-18T07:34:53.000Z,http://t.co/E5NFdTzonN,Serbia arrests seven over 1995 Srebrenica massacre
5.78048E+17,2015-03-18T04:17:23.000Z,http://t.co/fTMmrcYY4Z,Israel election: Netanyahu's Likud storms to victory
5.77936E+17,2015-03-17T20:55:44.000Z,http://t.co/KpOoySOLwK,Israel election results: as it happened
5.77898E+17,2015-03-17T18:22:20.000Z,http://t.co/W1JNSFaeVF,Mali helicopter crash: Two Dutch UN peacekeepers die
5.77866E+17,2015-03-17T16:17:29.000Z,http://t.co/rMoxieRVSI,Politics Live: 17 March
5.77861E+17,2015-03-17T15:54:55.000Z,http://t.co/v4lmVpPbcO,"Child abuse: Protect police who aid inquiry, MPs tell Cameron"
5.77842E+17,2015-03-17T14:39:22.000Z,http://t.co/rBLXdvEglc,Hillsborough inquests: David Duckenfield admits causing 96 deaths
5.77838E+17,2015-03-17T14:22:53.000Z,http://t.co/1IOLSjcKCi,BBC Savile abuse: Dame Janet Smith review 'due in May'
5.77787E+17,2015-03-17T11:02:10.000Z,http://t.co/V1r35DwEmi,NHS trust put into special measures
5.77772E+17,2015-03-17T10:02:06.000Z,http://t.co/8J72hCDQZN,Judges sacked for watching porn
5.7772E+17,2015-03-17T06:35:30.000Z,http://t.co/ZD5bQrjFix,Myanmar court finds trio guilty of insulting religion
5.77622E+17,2015-03-17T00:04:37.000Z,http://t.co/nvA9VPPWYu,Prince Harry to leave the Army in June
5.77603E+17,2015-03-16T22:50:22.000Z,http://t.co/cj2ZG8OlzQ,Cyril Smith child abuse inquiry 'scrapped after his arrest'
5.77546E+17,2015-03-16T19:05:50.000Z,http://t.co/vmyUH85zWC,Baby dies in Stechford 'after truck hits wall'
5.77544E+17,2015-03-16T18:55:40.000Z,http://t.co/46YI8tQZEM,Muslim Brotherhood leader Badie sentenced to death in Egypt
5.77428E+17,2015-03-16T11:15:19.000Z,http://t.co/VNZdu0DBjM,Teen 'planning to head to Syria'
5.77427E+17,2015-03-16T11:12:37.000Z,http://t.co/uBZuJQ0yTd,Metropolitan Police probed over child abuse 'cover-up' claims
5.77424E+17,2015-03-16T10:58:42.000Z,http://t.co/UY2bvR6VCa,Vladimir Putin: Russian leader dismisses 'gossip' over absence
5.77257E+17,2015-03-15T23:57:18.000Z,http://t.co/mD58QQo21s,Turkey sends teenagers back to UK after Syria attempt
5.77189E+17,2015-03-15T19:25:24.000Z,http://t.co/sf5tRxCo65,Syria girls: Families urge three UK teens to come home
5.77165E+17,2015-03-15T17:51:46.000Z,http://t.co/xgHWLjao2m,Jeffrey Williams arrested over Ferguson police shooting
5.77096E+17,2015-03-15T13:15:37.000Z,http://t.co/sA76LwXldG,"Syria conflict: US wants to 're-ignite' peace talks, says Kerry"
5.77025E+17,2015-03-15T08:33:20.000Z,http://t.co/uhrYAtEidP,Deadly blasts hit Pakistan churches in Lahore
5.76906E+17,2015-03-15T00:42:38.000Z,http://t.co/jOKEDCoZM4,Bus plunge in southern Brazil leaves 42 dead
5.76714E+17,2015-03-14T11:59:00.000Z,http://t.co/qSmaCPhbpY,Sierra Leone VP Samuel Sam-Sumana 'goes into hiding'
5.76419E+17,2015-03-13T16:26:27.000Z,http://t.co/KzqvCaXWcy,DJ Neil Fox arrested over sexual assault allegation
5.76372E+17,2015-03-13T13:18:46.000Z,http://t.co/5iZtuvBgCs,Weybridge junior school evacuated after 'explosion'
5.76363E+17,2015-03-13T12:43:55.000Z,http://t.co/Oseb4y4J2J,Fred Talbot: Ex-weatherman jailed for schoolboy abuse
5.7636E+17,2015-03-13T12:30:47.000Z,http://t.co/sTEv2MqhHh,UK's Afghanistan war effort honoured in service
5.7632E+17,2015-03-13T09:54:17.000Z,http://t.co/EwgppgIahH,Oscar Pistorius case: South African judge rejects murder appeal challenge
5.76299E+17,2015-03-13T08:27:38.000Z,http://t.co/ombEqesOJy,Julian Assange case: Sweden U-turn on questioning
5.76038E+17,2015-03-12T15:11:19.000Z,http://t.co/EgMDLOyLJ4,"Sir Terry Pratchett, renowned fantasy author, dies aged 66"
5.76013E+17,2015-03-12T13:33:01.000Z,http://t.co/xI6sHezkVy,Syria girls: Man arrested 'for helping British trio'
5.7597E+17,2015-03-12T10:41:21.000Z,http://t.co/E2nu36D3Ro,Business Live: 12 March 2015
5.75966E+17,2015-03-12T10:24:10.000Z,http://t.co/M3UEC08dXF,"UK surveillance 'lacks transparency', ISC report says"
5.7593E+17,2015-03-12T08:01:43.000Z,http://t.co/Sh6Q9inp0b,Ferguson police shot during protest
5.75925E+17,2015-03-12T07:44:05.000Z,http://t.co/WzqPPP2Tpw,Ebola: British patient and five colleagues flown home
5.75899E+17,2015-03-12T05:59:47.000Z,http://t.co/tLPZ5CZscR,Ferguson police chief Thomas Jackson quits
5.7578E+17,2015-03-11T22:08:16.000Z,http://t.co/06PnNMRPrk,Nemtsov daughter: Putin 'politically' to blame for murder
5.757E+17,2015-03-11T16:48:27.000Z,http://t.co/RvGxMsiJB3,UK female military health worker has Ebola
5.75684E+17,2015-03-11T15:47:23.000Z,http://t.co/nNPq3BUcsl,MPs expected to back cigarette plain packaging
5.75671E+17,2015-03-11T14:55:43.000Z,http://t.co/ckYtvi7zrj,Chelsea Paris Metro chants: Five men due in court
5.75626E+17,2015-03-11T11:54:53.000Z,http://t.co/6lzk6UbnUx,Saudis recall Sweden ambassador amid diplomatic row
5.756E+17,2015-03-11T10:10:32.000Z,http://t.co/p5LdLAaaaz,Woman could win cash payout 20 years after divorce
5.75589E+17,2015-03-11T09:27:45.000Z,http://t.co/LOYix1IoGD,Motorway thieves steal French jewels
5.75433E+17,2015-03-10T23:08:31.000Z,http://t.co/a2meD1mpWp,"Berlusconi ""bunga bunga"" case acquittal confirmed"
5.75336E+17,2015-03-10T16:43:36.000Z,http://t.co/39kp9v8jMC,"Jeremy Clarkson, Top Gear host, suspended by BBC after 'fracas'"
5.75282E+17,2015-03-10T13:07:50.000Z,http://t.co/aOqGabsz4B,Pakistan ends death penalty suspension after seven years
5.75214E+17,2015-03-10T08:37:02.000Z,http://t.co/gQNWVxMOYo,Three charged over Nottingham care home death
5.75168E+17,2015-03-10T05:36:48.000Z,http://t.co/zhNPU1WPl1,Slashed US ambassador Lippert leaves South Korea hospital
5.75138E+17,2015-03-10T03:34:49.000Z,http://t.co/ah7zVTq8iJ,Three French sports stars die in Argentina helicopter crash
5.74898E+17,2015-03-09T11:41:52.000Z,http://t.co/psMLx8lx1k,Relive England's World Cup exit
5.74771E+17,2015-03-09T03:15:55.000Z,http://t.co/2dOrDvBLka,Solar Impulse: Global flight completes first leg
5.74768E+17,2015-03-09T03:07:24.000Z,http://t.co/HhDMav0RVA,"Five killed in stabbing at house in Sumoto, Japan"
5.74723E+17,2015-03-09T00:07:13.000Z,http://t.co/0dgOa8aM0y,Doping culture in cycling 'still exists' according to Circ report
5.74625E+17,2015-03-08T17:37:58.000Z,http://t.co/pWmIl6FFiG,Man charged over incident on roof of Parliament
5.74555E+17,2015-03-08T13:00:43.000Z,http://t.co/Qi9WxaU7fU,Nemtsov killing: Russia court charges two men with murder
5.74323E+17,2015-03-07T21:36:00.000Z,http://t.co/eul5LEUHFm,Obama praises Selma 'heroes' 50 years after march
5.74293E+17,2015-03-07T19:39:12.000Z,http://t.co/fwwFmJGVZM,Nigeria's Boko Haram pledges allegiance to Islamic State
5.74219E+17,2015-03-07T14:43:22.000Z,http://t.co/SrRr9xfN9X,Ukraine crisis: Rebels 'pull heavy weapons' from front line
5.74148E+17,2015-03-07T10:01:36.000Z,http://t.co/ilFmKI0dOg,Egypt carries out first execution over Morsi clashes
5.74139E+17,2015-03-07T09:27:49.000Z,http://t.co/PsPkbkVN44,Nemtsov murder: Two held over killing of opposition politician
5.73892E+17,2015-03-06T17:03:14.000Z,http://t.co/IRUaBaZUe7,Harrison Ford plane crash: Doctor feared fireball
5.73877E+17,2015-03-06T16:06:18.000Z,http://t.co/schUCalLa6,"TV election debates will go ahead, say broadcasters"
5.73858E+17,2015-03-06T14:50:46.000Z,http://t.co/bm7wMCtnk5,"Boy, 13, admits Christopher Barry party row murder"
5.73856E+17,2015-03-06T14:41:46.000Z,http://t.co/Qj3qYbVDbp,Nasa's Dawn probe achieves orbit around Ceres
5.73832E+17,2015-03-06T13:04:55.000Z,http://t.co/cbRqDwgeT0,Becky Watts murder: Four in court over body parts
5.73803E+17,2015-03-06T11:11:27.000Z,http://t.co/58BnpvCrfj,Mother and lover jailed for Ayesha Ali killing
5.73787E+17,2015-03-06T10:05:45.000Z,http://t.co/88ksEJD5Tr,Dozens arrested in cybercrime 'strike week'
5.73768E+17,2015-03-06T08:51:19.000Z,http://t.co/SAB0HfLXzW,Russian Kremlin critic Alexei Navalny out of Moscow prison
5.73761E+17,2015-03-06T08:25:13.000Z,http://t.co/ookSVtZAKg,Jerusalem: Israeli police hit in Palestinian car attack
5.73636E+17,2015-03-06T00:06:25.000Z,http://t.co/j0oNzY3O0S,Harrison Ford injured in plane crash
5.7359E+17,2015-03-05T21:05:11.000Z,http://t.co/8GA2U0FkiJ,Syria's al-Nusra Front commander 'killed in strike'
5.73543E+17,2015-03-05T17:59:30.000Z,http://t.co/a8zdvfaAOa,Nisman family say Argentina prosecutor was murdered
5.73538E+17,2015-03-05T17:37:21.000Z,http://t.co/sjJDsyoBYt,TV election debates: DUP says process is in 'utter mess'
5.73527E+17,2015-03-05T16:53:12.000Z,http://t.co/E52LMRKmTe,'Boko Haram' kills dozens in raid on Nigerian village
5.73525E+17,2015-03-05T16:48:28.000Z,http://t.co/UNJtsQawxd,US snow: Plane skids off New York runway
5.73454E+17,2015-03-05T12:05:30.000Z,http://t.co/a8r9ixf2jU,UK interest rates mark six years at record low of 0.5%
5.73454E+17,2015-03-05T12:02:33.000Z,http://t.co/NNVz3JlCN1,Ebola outbreak: Liberia releases last patient
5.7345E+17,2015-03-05T11:48:42.000Z,http://t.co/EO0p2eCmDN,Teacher Jamshed Javeed jailed for Syria 'jihad' plan
5.73424E+17,2015-03-05T10:06:01.000Z,http://t.co/Iw7WWjkHyH,Nathan Matthews in court on Becky Watts murder charge
5.7341E+17,2015-03-05T09:10:47.000Z,http://t.co/e43OXkamle,South Korea US envoy Lippert 'well' after knife attack
5.73381E+17,2015-03-05T07:14:40.000Z,http://t.co/CHsDjx4Rpu,Indonesia rejects Australia Bali Nine prisoner swap offer
5.7324E+17,2015-03-04T21:55:52.000Z,http://t.co/dZdByWtbtx,Election 2015: Cameron agrees to just one TV debate
5.73183E+17,2015-03-04T18:05:57.000Z,http://t.co/qiyxbyKqHG,'First human' discovered in Ethiopia
5.73168E+17,2015-03-04T17:07:04.000Z,http://t.co/RPzp5FJpLy,Syria conflict: Blast hits Aleppo intelligence HQ
5.73155E+17,2015-03-04T16:15:49.000Z,http://t.co/blOmm62nQt,Stepbrother charged with Becky Watts murder in Bristol
5.73116E+17,2015-03-04T13:40:06.000Z,http://t.co/H2OBVKwcTY,Mexico arrests Zetas cartel leader Omar Trevino Morales
5.7308E+17,2015-03-04T11:17:26.000Z,http://t.co/GBtvTcVVR2,Hillsborough inquests: Police told to 'blame fans'
5.73077E+17,2015-03-04T11:07:15.000Z,http://t.co/14ofTnL1D8,Ayesha Ali killing: Mother and lover found guilty
5.73073E+17,2015-03-04T10:52:16.000Z,http://t.co/hryTHxN7Vq,Nemtsov murder: Putin urges end to political killings
5.7307E+17,2015-03-04T10:36:54.000Z,http://t.co/7R8VAgRRTW,"Andrew Mitchell in £80,000 libel payout to 'plebgate' PC"
5.73022E+17,2015-03-04T07:27:47.000Z,http://t.co/xhHaCtz3yC,Ukraine coal mine: Dozens feared dead in Zasyadko gas blast
5.72884E+17,2015-03-03T22:17:32.000Z,http://t.co/nfF8WGyq9d,Syria death reported of ex-British marine fighting alongside Kurds
5.72804E+17,2015-03-03T17:00:37.000Z,http://t.co/UQHsqT6cBU,'Jihadi John's' father Jasem Emwazi 'in state of shock'
5.72799E+17,2015-03-03T16:39:41.000Z,http://t.co/el3MVnikKI,Ex-CIA chief in federal charge plea
5.72739E+17,2015-03-03T12:43:02.000Z,http://t.co/RTKirzlSoi,Phone hacking 'rife' at Mirror Group Newspapers
5.72728E+17,2015-03-03T12:00:23.000Z,http://t.co/ZXWbrPfmhs,Furness baby deaths inquiry: 'Lethal mix of failures'
5.72723E+17,2015-03-03T11:37:42.000Z,http://t.co/rLcRvUlyr1,Becky Watts: Body parts found at Bristol house
5.72713E+17,2015-03-03T11:01:31.000Z,http://t.co/HGv8HsxGSm,Oxfordshire grooming victims may have totalled 373 children
5.72656E+17,2015-03-03T07:13:36.000Z,http://t.co/eXCdAxFBSW,Business Live: 3 March 2015
5.72448E+17,2015-03-02T17:25:21.000Z,http://t.co/rCY7c8rn06,"Adam Johnson arrested on suspicion of sexual activity with girl, 15"
