id,created_at,url,Titles
8.78328E+17,2017-06-23T19:04:00.000Z,https://t.co/E378vcDOOj,Camden flats: Hundreds of homes evacuated over fire risk fears
8.78435E+17,2017-06-24T02:08:31.000Z,https://t.co/DlvzvVb8zm,"China landslide: 15 dead, over 100 missing in Sichuan"
8.78547E+17,2017-06-24T09:36:59.000Z,https://t.co/Nbg5RuoFgP,Cladding fire tests failed by 34 blocks in 17 areas
8.78629E+17,2017-06-24T14:59:41.000Z,https://t.co/8r3C38xxqr,Parliament hit by 'sustained' cyber-attack
8.78828E+17,2017-06-25T04:12:12.000Z,https://t.co/AVc00R85iA,Pakistan fuel tanker inferno kills at least 150
8.78912E+17,2017-06-25T09:43:28.000Z,https://t.co/Yt2kMhbcLc,Newcastle Eid celebration: Woman bailed after crash
8.79013E+17,2017-06-25T16:28:27.000Z,https://t.co/O1xtMRmwHo,More high-rises fail fire safety tests
8.79083E+17,2017-06-25T21:06:26.000Z,https://t.co/FXo9QzZGoe,Colombia boat sinking: Seven killed and two missing
8.79246E+17,2017-06-26T07:53:11.000Z,https://t.co/PPaxzjSUJh,Liu Xiaobo: Jailed Chinese dissident has terminal cancer
8.79282E+17,2017-06-26T10:15:44.000Z,https://t.co/knVBz3HNkv,Conservatives agree pact with DUP to support May government
8.79293E+17,2017-06-26T10:59:15.000Z,https://t.co/P6y31KLTeb,Finsbury Park attack: Minute's silence held for victims
8.79316E+17,2017-06-26T12:30:24.000Z,https://t.co/NcNYpn5v9O,Painter Salvador Dali's body to be exhumed for paternity suit
8.79317E+17,2017-06-26T12:36:14.000Z,https://t.co/u2IgxNaclS,Ex-Archbishop Lord Carey resigns after child abuse review
8.79332E+17,2017-06-26T13:32:29.000Z,https://t.co/i2YYLKN8UM,Al-Qaeda: Kidnapped Swede Johan Gustafsson freed after six years
8.79338E+17,2017-06-26T13:59:20.000Z,https://t.co/ASSTw51v5m,and May gives detail on EU citizens
8.79349E+17,2017-06-26T14:43:50.000Z,https://t.co/yWnt5kSLNA,Trump travel ban injunction partly lifted by top US court
8.79353E+17,2017-06-26T14:56:42.000Z,https://t.co/ZRpXCYT6mX,Grenfell Tower: Cladding firm ends global sales for tower blocks
8.79438E+17,2017-06-26T20:34:20.000Z,https://t.co/ScYxGG3Fjs,"Senate healthcare bill leaves 22m more without cover, CBO says"
8.7948E+17,2017-06-26T23:22:46.000Z,https://t.co/RNKyMf1ujw,Brazil's Michel Temer charged with corruption
8.7952E+17,2017-06-27T02:01:50.000Z,https://t.co/nMVrxccYC0,"Syria chemical attack may be being prepared, US warns"
8.79639E+17,2017-06-27T09:52:26.000Z,https://t.co/ht4wkIsW9l,Google hit with record EU fine over Shopping service
8.79662E+17,2017-06-27T11:26:37.000Z,https://t.co/wKVdFmVvig,Grenfell Tower fire: Theresa May calls for cladding investigation
8.79696E+17,2017-06-27T13:39:16.000Z,https://t.co/pgxACI7SCK,Nicola Sturgeon puts Scottish independence referendum bill on hold
8.79715E+17,2017-06-27T14:55:53.000Z,https://t.co/lysGDBHwXd,Global ransomware attack causes turmoil
8.79735E+17,2017-06-27T16:14:31.000Z,https://t.co/l7ebt5mJo4,Charlie Gard parents lose European court appeal
8.79761E+17,2017-06-27T17:57:12.000Z,https://t.co/hD35PhSobq,Republicans delay Senate healthcare vote
8.79866E+17,2017-06-28T00:57:37.000Z,https://t.co/lD2PkrnQJN,Venezuela crisis: Helicopter launches attack on Supreme Court
8.80008E+17,2017-06-28T10:21:36.000Z,https://t.co/VchjngebtT,David Duckenfield faces Hillsborough charges with five others
8.80014E+17,2017-06-28T10:45:42.000Z,https://t.co/tdA95iRiDW,Business Live: Sterling rebounds
8.80021E+17,2017-06-28T11:11:04.000Z,https://t.co/SAHAugvcxD,As-it-happened: Queen's Speech debate and Prime Minister's Questions
8.80033E+17,2017-06-28T12:00:41.000Z,https://t.co/Effu6HjFiC,Paddington Bear creator Michael Bond dies
8.80045E+17,2017-06-28T12:45:50.000Z,https://t.co/Pr1saO4gus,BBC Local Live: North West of England on Friday 30 June
8.80063E+17,2017-06-28T13:57:35.000Z,https://t.co/u3lbNzsB0V,"No final Grenfell Tower death toll this year, police say"
8.80184E+17,2017-06-28T21:58:19.000Z,https://t.co/htvoNjWOgD,Grenfell Tower: Retired judge to lead disaster inquiry
8.80217E+17,2017-06-29T00:11:45.000Z,https://t.co/L9awlpkYYt,Cardinal Pell: Vatican treasurer denies Australia sex offences
8.80237E+17,2017-06-29T01:32:18.000Z,https://t.co/XoZ3L8HwMd,Brazil's presidential palace rammed by car as Temer under pressure to quit
8.80384E+17,2017-06-29T11:14:21.000Z,https://t.co/xcpIeLWKqV,Sky-Fox takeover deal likely to face competition probe
8.80411E+17,2017-06-29T13:01:40.000Z,https://t.co/q13XYd9rLN,Northern Ireland women to get free abortions in England
8.80413E+17,2017-06-29T13:09:54.000Z,https://t.co/TKVQT0S4K6,Chechen gang guilty of Nemtsov's murder
8.80468E+17,2017-06-29T16:48:23.000Z,https://t.co/hesU1rjOmb,Queen's Speech: MPs vote for government's agenda
8.80589E+17,2017-06-30T00:49:23.000Z,https://t.co/Po5muLQmfs,Trump travel ban comes into effect for six countries
8.80686E+17,2017-06-30T07:13:34.000Z,https://t.co/4eJxGM5fGb,Germany gay marriage approved by MPs in snap vote
8.80789E+17,2017-06-30T14:05:45.000Z,https://t.co/NjYSnrtR1U,Camber Sands: Lifeguards 'may not have prevented deaths'
8.8079E+17,2017-06-30T14:06:52.000Z,https://t.co/ZN2R0ZAxNw,France's Marine Le Pen charged over funding scandal
8.80813E+17,2017-06-30T15:39:05.000Z,https://t.co/K9MoCjyobn,Charlie Gard parents given more time to say goodbye to terminally ill son
8.80824E+17,2017-06-30T16:23:29.000Z,https://t.co/3GznLWuCyV,Grenfell fire: Council leader quits over fire response
8.8087E+17,2017-06-30T19:24:36.000Z,https://t.co/Km0JpFSPv4,New York hospital: Ex-employee opens fire in Bronx
8.81106E+17,2017-07-01T11:05:13.000Z,https://t.co/P0K6Mi48f3,Film critic Barry Norman dies
8.81468E+17,2017-07-02T11:03:44.000Z,https://t.co/9xaxeFhUnM,Andy Murray and Kim Sears 'happy' to be expecting second child
8.81582E+17,2017-07-02T18:35:10.000Z,https://t.co/I4NacFVoOU,Drone causes Gatwick Airport disruption
8.81821E+17,2017-07-03T10:25:18.000Z,https://t.co/sIgiQ1CcvR,Katie Rough death: Girl pleads guilty to manslaughter
8.81876E+17,2017-07-03T14:03:34.000Z,https://t.co/vRLU6w1MOh,Jersey care abuse inquiry: Children 'still at risk'
8.81899E+17,2017-07-03T15:34:13.000Z,https://t.co/HiI2E51XpV,Stormont power-sharing deal 'remains achievable'
8.81939E+17,2017-07-03T18:15:30.000Z,https://t.co/m8cV4a0DZI,Boston airport crash: Taxi mows down pedestrians injuring 10
8.82126E+17,2017-07-04T06:36:16.000Z,https://t.co/JaSJdu9Nx2,North Korea hails 'ICBM test' success
8.82176E+17,2017-07-04T09:55:52.000Z,https://t.co/8MyOF32gsc,Feltham boy's solitary confinement breached human rights
8.82236E+17,2017-07-04T13:54:31.000Z,https://t.co/M0D3uxS9iu,Grenfell Tower fire: Three hospitals fail fire safety checks
8.82367E+17,2017-07-04T22:36:17.000Z,https://t.co/rbfFtYJC5g,North Korea missile: US confirms long-range test
8.82576E+17,2017-07-05T12:26:02.000Z,https://t.co/DSy0v6iBZz,Business Live: Inflation divides US Fed
8.82631E+17,2017-07-05T16:02:23.000Z,https://t.co/4zoTQZBeHy,"Qatar crisis: Restrictions to continue, Saudi Arabia says"
8.82812E+17,2017-07-06T04:01:11.000Z,https://t.co/1HRvZDd2Sv,"Tony Blair 'not straight' with UK over Iraq, says Chilcot"
8.8288E+17,2017-07-06T08:30:58.000Z,https://t.co/prBHwSKSJ4,Trump says Western civilisation at stake in Warsaw speech
8.82908E+17,2017-07-06T10:25:18.000Z,https://t.co/tDjmwkeXXl,EU and Japan reach free trade deal
8.83283E+17,2017-07-07T11:13:45.000Z,https://t.co/282BiKLg4m,G20: Trump and Putin hold first face-to-face talks
8.83338E+17,2017-07-07T14:50:50.000Z,https://t.co/8UzxEl0Hgm,Bradley Lowery: Sunderland fan dies after long illness
8.83364E+17,2017-07-07T16:37:31.000Z,https://t.co/TSO99LYjqG,Charlie Gard: Mother says terminally-ill son 'not in pain and suffering'
8.83428E+17,2017-07-07T20:50:35.000Z,https://t.co/F57PsYuwY4,G20: Trump and Putin debate US election hack at first meeting
8.83589E+17,2017-07-08T07:30:56.000Z,https://t.co/z2NzQ4dbJx,"G20: UK-US trade deal to happen quickly, says Trump"
8.83655E+17,2017-07-08T11:52:56.000Z,https://t.co/jteYzNJbzO,Woman and three children die in Bolton house fire
8.83687E+17,2017-07-08T14:00:42.000Z,https://t.co/d6SUgOrRBF,G20 Hamburg: Leaders fail to bridge Trump climate chasm
8.84025E+17,2017-07-09T12:21:51.000Z,https://t.co/aY9KSnLUxh,Mosul: Iraq PM in city to celebrate victory over IS
8.84044E+17,2017-07-09T13:36:44.000Z,https://t.co/lkHnEEGk2p,Charlie Gard case: Great Ormond Street in new court bid
8.84349E+17,2017-07-10T09:51:40.000Z,https://t.co/tOCJZ57iW1,UK arms sales to Saudi Arabia ruled lawful
8.84442E+17,2017-07-10T16:00:49.000Z,https://t.co/cKfRUUaJLJ,Birmingham pub bombings: IRA suspect Hayes issues apology
8.84456E+17,2017-07-10T16:55:47.000Z,https://t.co/whhBTpwyrH,MP Anne Marie Morris suspended for racist remark
8.84548E+17,2017-07-10T23:02:29.000Z,https://t.co/XMhwfQSwwP,East London double acid attack: John Tomlin appears in court
8.84674E+17,2017-07-11T07:19:40.000Z,https://t.co/TrR86VzUSM,US President Donald Trump 'to visit UK in 2018'
8.84734E+17,2017-07-11T11:18:29.000Z,https://t.co/gtkPwLzMxT,Contaminated blood scandal inquiry announced
8.84734E+17,2017-07-11T11:21:35.000Z,https://t.co/ov7iwcpGNB,BBC News
8.8477E+17,2017-07-11T13:44:12.000Z,https://t.co/Dq3QLLZuXT,Briton Luke Rutter killed fighting IS in Syria
8.84795E+17,2017-07-11T15:21:57.000Z,https://t.co/j2aCEMW2jF,Donald Trump Jr emails show Russia communication
8.84812E+17,2017-07-11T16:29:47.000Z,https://t.co/DEbKnaA8cZ,Aristocrat guilty over 'menacing' Gina Miller Facebook post
8.85055E+17,2017-07-12T08:33:31.000Z,https://t.co/VhWprAuiQo,UK unemployment drops to 1.49m
8.85081E+17,2017-07-12T10:17:09.000Z,https://t.co/0nKkND8Fa5,Giant iceberg splits from Antarctic
8.85188E+17,2017-07-12T17:23:42.000Z,https://t.co/mTky0PwKVM,Brazil's ex-President Lula convicted of corruption
8.85424E+17,2017-07-13T09:00:55.000Z,https://t.co/BWXG2Kn65r,Theresa May 'shed a tear' at election exit poll
8.85454E+17,2017-07-13T11:00:32.000Z,https://t.co/lURASB0x1E,Brexit: The UK's key repeal bill facing challenges
8.85491E+17,2017-07-13T13:27:15.000Z,https://t.co/k0A1OViGqM,Liu Xiaobo: China's most prominent dissident dies
8.85493E+17,2017-07-13T13:37:55.000Z,https://t.co/8Mdy7aO9pv,Liu Xiaobo: The man China couldn't erase
8.8569E+17,2017-07-14T02:37:04.000Z,https://t.co/gzfCszjn4n,London acid attacks: Two teenagers arrested
8.85791E+17,2017-07-14T09:19:06.000Z,https://t.co/hhyjalP4Yt,Israeli police killed in attack near Jerusalem holy site
8.85831E+17,2017-07-14T11:58:04.000Z,https://t.co/XIzymeKYMf,Cheeki Rafiki deaths: Yacht firm boss guilty of safety breach
8.85865E+17,2017-07-14T14:13:59.000Z,https://t.co/pOtP7CnWvB,Egypt Hurghada stabbing: Two Germans killed at Red Sea resort
8.86169E+17,2017-07-15T10:20:13.000Z,https://t.co/NGq1mClFnR,"Girl, 15, dies in Newton Abbot after 'legal high reaction'"
8.86323E+17,2017-07-15T20:32:52.000Z,https://t.co/eGa9cm1ccZ,Teenager charged over London acid attacks
8.86336E+17,2017-07-15T21:24:32.000Z,https://t.co/t0KEf5OX1u,Senegal Demba Diop: Football stadium collapse kills eight
8.86608E+17,2017-07-16T15:28:07.000Z,https://t.co/HS3Z0CmVST,Jodie Whittaker: Doctor Who's 13th Time Lord to be a woman
8.86707E+17,2017-07-16T21:58:35.000Z,https://t.co/mYx1Vjokfe,Living Dead director George A Romero dies at 77
8.86885E+17,2017-07-17T09:45:37.000Z,https://t.co/GWq2Vg2dVc,Jordan soldier who killed US trainers jailed for life
8.86897E+17,2017-07-17T10:35:57.000Z,https://t.co/MHfbilWNmx,Chancellor Philip Hammond hits back over public pay leaks
8.87229E+17,2017-07-18T08:33:54.000Z,https://t.co/9aEt9NUY48,UK inflation unexpectedly slows to 2.6% in June
8.87232E+17,2017-07-18T08:46:55.000Z,https://t.co/QfNrjaHqFL,Spain football chief Angel Maria Villar Llona arrested
8.87436E+17,2017-07-18T22:15:29.000Z,https://t.co/QgPYABASQ1,"Trump and Putin had another, undisclosed conversation at G20"
8.87577E+17,2017-07-19T07:37:42.000Z,https://t.co/pwmJjRelRN,French military head de Villiers quits over cuts
8.87613E+17,2017-07-19T10:01:11.000Z,https://t.co/TA53Pef6kU,BBC pay: Chris Evans tops list of best-paid stars
8.8766E+17,2017-07-19T13:05:45.000Z,https://t.co/34HjrwnDCa,State pension age rise brought forward
8.87828E+17,2017-07-20T00:14:08.000Z,https://t.co/USB2jGPYHi,"John McCain has brain cancer, his office says"
8.87922E+17,2017-07-20T06:28:19.000Z,https://t.co/i6fVY4aDSG,Sports Direct profits more than halve
8.88043E+17,2017-07-20T14:30:23.000Z,https://t.co/Fk3uLIQGVw,AlphaBay and Hansa dark web markets shut down
8.88052E+17,2017-07-20T15:04:52.000Z,https://t.co/yA7ljYorLW,Vince Cable is new Lib Dem leader
8.88108E+17,2017-07-20T18:47:55.000Z,https://t.co/JwDovNCQCe,Chester Bennington: Linkin Park vocalist 'took his own life'
8.88111E+17,2017-07-20T18:57:45.000Z,https://t.co/O9LNVR9ViW,OJ Simpson to be freed from Nevada prison
8.88312E+17,2017-07-21T08:18:10.000Z,https://t.co/mjPzevcZEy,North Korea tourism: US to ban Americans from visiting
8.88375E+17,2017-07-21T12:29:21.000Z,https://t.co/hcO7iNLDiN,East Jerusalem: Palestinians killed as holy site tensions soar
8.88394E+17,2017-07-21T13:44:26.000Z,https://t.co/Pm0UsinFy2,As it happened: Corrie Mckeague search ends
8.88429E+17,2017-07-21T16:03:00.000Z,https://t.co/hmu19myleW,White House press secretary Sean Spicer resigns
8.88506E+17,2017-07-21T21:09:48.000Z,https://t.co/Fu9WUYTdKh,Three Israelis stabbed to death in West Bank attack
8.88786E+17,2017-07-22T15:39:42.000Z,https://t.co/ChCdPCkl3y,Tour de France stage 20: Froome remains in yellow jersey
8.89184E+17,2017-07-23T18:03:47.000Z,https://t.co/4acZ9IgFPd,Israeli 'kills attacker' at Jordan embassy
8.894E+17,2017-07-24T08:19:39.000Z,https://t.co/XkJjz2Emby,Poland's President Duda vetoes judicial reforms after protests
8.89429E+17,2017-07-24T10:14:59.000Z,https://t.co/Rj0jLDSbdE,US-Russia probe: Trump son-in-law Kushner denies collusion
8.89439E+17,2017-07-24T10:54:22.000Z,https://t.co/TaL8Cx1lOf,Switzerland chainsaw attack: Police hunt Schaffhausen attacker
8.89477E+17,2017-07-24T13:26:51.000Z,https://t.co/KtCQrzzmtf,Charlie Gard parents end legal fight for 'beautiful' baby
8.89536E+17,2017-07-24T17:23:23.000Z,https://t.co/WkNwGFeccf,Trump son-in-law Kushner defends conduct after Senate testimony
8.89618E+17,2017-07-24T22:45:46.000Z,https://t.co/1MC469cFTP,Israel removes flashpoint metal detectors at Jerusalem holy site
8.89827E+17,2017-07-25T12:36:41.000Z,https://t.co/wVnVXHw1cX,Electric Mini to be built in Oxford
8.8989E+17,2017-07-25T16:46:34.000Z,https://t.co/Trm9rgM05R,Charlie Gard: Court hears hospice best option for baby
8.89926E+17,2017-07-25T19:10:39.000Z,https://t.co/mQJbWWxL6R,Obamacare: First Republican healthcare bill fails in US Senate
8.8993E+17,2017-07-25T19:25:56.000Z,https://t.co/F8LpZrrGhv,Switzerland chainsaw attack: Suspect arrested in Thalwil
8.89958E+17,2017-07-25T21:19:50.000Z,https://t.co/tPWeREswhW,US moves one step closer to imposing fresh Russia sanctions
8.90083E+17,2017-07-26T05:33:32.000Z,https://t.co/w5ymFFPglr,France wildfires force mass evacuation
8.90128E+17,2017-07-26T08:33:52.000Z,https://t.co/H30EAFPFeE,UK economic growth rate edges slightly higher
8.90136E+17,2017-07-26T09:04:21.000Z,https://t.co/8INjaOVv2T,"Employment tribunal fees unlawful, Supreme Court rules"
8.90141E+17,2017-07-26T09:24:48.000Z,https://t.co/ehTbuGSGkQ,Sports Direct boss Mike Ashley wins £15m court case
8.90199E+17,2017-07-26T13:16:08.000Z,https://t.co/PvppF4QcTo,Trump: Transgender people 'can't serve' in US military
8.90247E+17,2017-07-26T16:28:18.000Z,https://t.co/19FSP6dyKD,Charlie Gard parents hold private talks about his end of life care
8.90456E+17,2017-07-27T06:18:51.000Z,https://t.co/oLGCWhYBc4,Business Live: Wall St gives up gains
8.90471E+17,2017-07-27T07:17:23.000Z,https://t.co/NHMetRh300,Israel removes Jerusalem flashpoint security apparatus
8.90508E+17,2017-07-27T09:43:07.000Z,https://t.co/qsqctSYHoP,Madonna accepts damages over 'invasion of privacy'
8.90593E+17,2017-07-27T15:20:29.000Z,https://t.co/mtmEI87lb0,Charlie Gard parents 'denied final wish' for more time
8.90624E+17,2017-07-27T17:26:20.000Z,https://t.co/WS9HFtPRAC,Grenfell Tower: Corporate manslaughter considered by police
8.90703E+17,2017-07-27T22:37:03.000Z,https://t.co/Ik306juL2j,Russia sanctions: Trump's hand forced by Senate vote
8.90808E+17,2017-07-28T05:34:37.000Z,https://t.co/7wpz61nn8b,US healthcare: Senate 'skinny repeal' bill fails
8.9082E+17,2017-07-28T06:22:17.000Z,https://t.co/g428M7HLnh,Barclays sets aside extra £700m for PPI
8.90824E+17,2017-07-28T06:38:49.000Z,https://t.co/XnPfmxsHLX,Barcelona train crash injures 54
8.90833E+17,2017-07-28T07:14:31.000Z,https://t.co/6eOOFFsC3j,Pakistan PM Nawaz Sharif resigns after Panama Papers verdict
8.90867E+17,2017-07-28T09:30:01.000Z,https://t.co/P2S4vixYkW,Russia orders US to cut embassy staff in retaliation for sanctions
8.90941E+17,2017-07-28T14:26:13.000Z,https://t.co/skWhoS8Gbx,Hamburg supermarket attack leaves one dead
8.90957E+17,2017-07-28T15:27:02.000Z,https://t.co/ubnRIhscAw,North Korea conducts new intercontinental missile test
8.90968E+17,2017-07-28T16:12:07.000Z,https://t.co/FXNUK2Pc9r,Grenfell Tower: 82 buildings fail new fire safety test
8.9098E+17,2017-07-28T17:00:59.000Z,https://t.co/VxWzhiRKsO,Turkish court frees seven journalists as trial continues
8.90986E+17,2017-07-28T17:22:50.000Z,https://t.co/54ewH1gfdh,Charlie Gard parents announce death of 'beautiful boy'
8.9104E+17,2017-07-28T20:55:52.000Z,https://t.co/iYTcUQCftG,John Kelly appointment: Trump replaces chief of staff Priebus
8.91242E+17,2017-07-29T10:19:02.000Z,https://t.co/TMECSQyxj0,Hamburg supermarket attacker 'was known Islamist'
8.91316E+17,2017-07-29T15:14:38.000Z,https://t.co/0T2GAz2OHT,Johannesburg football stadium crush kills two
8.91427E+17,2017-07-29T22:35:57.000Z,https://t.co/nBbmp0edGs,Australia police 'foil terror plot to bring down plane'
8.91564E+17,2017-07-30T07:40:53.000Z,https://t.co/8CI4OOhiY9,German nightclub shooting: Two dead in Konstanz
8.9164E+17,2017-07-30T12:41:14.000Z,https://t.co/AYGgzfB3ol,Israeli soldier who killed wounded Palestinian attacker loses appeal
8.91655E+17,2017-07-30T13:41:03.000Z,https://t.co/TJ0AOEokqx,Venezuela crisis: Deadly clashes amid tense election for assembly
8.91872E+17,2017-07-31T04:03:23.000Z,https://t.co/MsEa5oAqQM,Venezuela's Maduro claims poll victory as opposition cries foul
8.91918E+17,2017-07-31T07:08:23.000Z,https://t.co/zaPmDbcCxd,Kabul attack: Gun battle and suicide bombing in Afghan capital
8.91955E+17,2017-07-31T09:34:38.000Z,https://t.co/Gyi4zVcr7I,Iraq War: Bid to prosecute Tony Blair rejected by High Court
8.92019E+17,2017-07-31T13:46:55.000Z,https://t.co/VcHGPtkk1E,Ciarán Maxwell: Royal Marine bomb maker given 18 years
8.92047E+17,2017-07-31T15:39:09.000Z,https://t.co/a03fsn1cAi,Sam Shepard: US actor and playwright dies aged 73
8.92051E+17,2017-07-31T15:54:24.000Z,https://t.co/ibnfiUxKH2,HMP The Mount disturbance: Riot staff sent to tackle violence
8.92093E+17,2017-07-31T18:41:56.000Z,https://t.co/pIEklyRRwe,Anthony Scaramucci sacked as Trump media chief
8.92106E+17,2017-07-31T19:35:14.000Z,https://t.co/5iUEdBaUnn,US imposes sanctions on Venezuelan leader Nicolás Maduro
8.92265E+17,2017-08-01T06:06:10.000Z,https://t.co/gw6bOX628s,British Gas to raise electricity prices
8.9236E+17,2017-08-01T12:21:12.000Z,https://t.co/Okin3AfSaQ,Moscow court shooting: Gang suspects killed in escape bid
8.92427E+17,2017-08-01T16:50:54.000Z,https://t.co/HXpwwXObJY,Herat mosque blast kills dozens in Afghanistan
8.92696E+17,2017-08-02T10:38:17.000Z,https://t.co/aNyvZsjHuI,'Three Musketeers' guilty of planning UK terror plot
8.92727E+17,2017-08-02T12:39:53.000Z,https://t.co/5ggAO00RFq,Venezuela vote: Turnout figure 'tampered with'
8.9274E+17,2017-08-02T13:32:48.000Z,https://t.co/rQ22vKnRrX,Mourne Mountains: Ambulances in Army cadets rescue
8.92751E+17,2017-08-02T14:17:45.000Z,https://t.co/4RER4UZl11,Prince Philip carries out final official engagement
8.92757E+17,2017-08-02T14:42:29.000Z,https://t.co/BWjHDjOHN7,Trump approves new 'flawed' Russia sanctions
8.9279E+17,2017-08-02T16:50:13.000Z,https://t.co/O1fFtqlr09,Two killed in Portugal beach plane crash
8.92793E+17,2017-08-02T17:02:43.000Z,https://t.co/31dlIKJsMp,Human embryos edited to stop disease
8.92804E+17,2017-08-02T17:47:39.000Z,https://t.co/eih9IDV4od,Romford doctor Manish Shah charged with 118 sexual offences
8.9306E+17,2017-08-03T10:43:18.000Z,https://t.co/1Z2uGLqkVp,'Three Musketeer' jihadis get life sentences for UK terror plot
8.93065E+17,2017-08-03T11:04:00.000Z,https://t.co/uUd6GmOfsG,Business Live: Dow Jones hits high
8.93071E+17,2017-08-03T11:28:16.000Z,https://t.co/eGmIWEOJSK,Ian Paterson: Disgraced breast surgeon has sentence increased
8.93127E+17,2017-08-03T15:09:52.000Z,https://t.co/b1Q8WPSr22,Robert Hardy: Harry Potter and All Creatures Great and Small star dies
8.93155E+17,2017-08-03T17:00:41.000Z,https://t.co/UeG8LHbaed,'Paracetamol and caffeine mix' in Rashan Charles' throat
8.93166E+17,2017-08-03T17:46:18.000Z,https://t.co/qzvumUyWbK,NHS cyber-defender Marcus Hutchins to appear in US court
8.93179E+17,2017-08-03T18:38:27.000Z,https://t.co/P1G08G7n2O,Afghan convoy attack: Nato soldier killed in suicide blast
8.93188E+17,2017-08-03T19:13:07.000Z,https://t.co/Ha8TZD7ldh,Michelle Carter: What the texting suicide case tells us
8.93439E+17,2017-08-04T11:49:13.000Z,https://t.co/ia9Hvak4p4,Neymar: Paris St-Germain's new signing said he left Barcelona for a new challenge
8.93472E+17,2017-08-04T14:01:24.000Z,https://t.co/FGVyA2JGNc,Helicopter sex film police crew cleared of misconduct
8.93547E+17,2017-08-04T18:58:50.000Z,https://t.co/gYXMI24acT,'Pharma bro' Martin Shkreli convicted of fraud
8.93581E+17,2017-08-04T21:13:43.000Z,https://t.co/cB3NVbpKfc,US notifies UN of Paris climate deal pullout
8.93627E+17,2017-08-05T00:18:29.000Z,https://t.co/g9Gs9Et3Jr,Rwanda election: President Paul Kagame wins by landslide
8.93863E+17,2017-08-05T15:57:10.000Z,https://t.co/bPajLFDD5n,New Venezuela assembly sacks government critic Luisa Ortega
8.93912E+17,2017-08-05T19:09:33.000Z,https://t.co/YU2zy30mxE,North Korea: UN backs fresh sanctions over missile tests
8.9412E+17,2017-08-06T08:58:11.000Z,https://t.co/v3kQTGzgnD,Shoreham boat sinking: One dead and two people missing
8.94177E+17,2017-08-06T12:41:49.000Z,https://t.co/Xqrp0cw4ut,Venezuela arrests over 'uprising attempt'
8.94588E+17,2017-08-07T15:55:30.000Z,https://t.co/gO4VEo2NjL,Judge approves suicidal girl care plan
8.94872E+17,2017-08-08T10:45:12.000Z,https://t.co/4iXKpTdVeC,Helicopter sex film officer Adrian Pogmore jailed
8.94963E+17,2017-08-08T16:47:43.000Z,https://t.co/cz9TbHYbME,South Africa Jacob Zuma survives no-confidence vote
8.95005E+17,2017-08-08T19:32:24.000Z,https://t.co/pRe69V5jsK,Donald Trump threatens 'fury' against N Korea
8.95021E+17,2017-08-08T20:36:03.000Z,https://t.co/hvU8vKmNmh,Country star Glen Campbell dies at 81
8.95185E+17,2017-08-09T07:30:15.000Z,https://t.co/xTbhJfOccb,Paris attack: Man held after car rams into soldiers
8.95198E+17,2017-08-09T08:21:01.000Z,https://t.co/YXnIhFhDHm,Kenya election 2017: Raila Odinga says election systems hacked
8.95249E+17,2017-08-09T11:43:28.000Z,https://t.co/NrmZvyIRmX,North Korea 'considering missile strike on US Guam base'
8.95283E+17,2017-08-09T13:58:16.000Z,https://t.co/Mgej1dXbxQ,Operation Sanctuary: Newcastle child sex network convicted
8.95292E+17,2017-08-09T14:34:02.000Z,https://t.co/y5XPYyyZjZ,Paul Manafort: FBI raided home of former Trump chairman
8.95311E+17,2017-08-09T15:47:52.000Z,https://t.co/JOgyNZaz52,'PC fantasist' guilty of sex game murder and arson
8.95549E+17,2017-08-10T07:36:10.000Z,https://t.co/5v7XQ6ndWS,Lavender Hill bus crash: Two women rescued
8.95594E+17,2017-08-10T10:35:17.000Z,https://t.co/3A0jj1ZLMr,Modern slavery and trafficking 'in every UK town and city'
8.95615E+17,2017-08-10T11:56:24.000Z,https://t.co/l7rg0DoaeT,"Eggs scandal: 700,000 sent to UK but risk is 'unlikely'"
8.9563E+17,2017-08-10T12:57:24.000Z,https://t.co/OMeR7Bv0Cb,Putney Bridge bus-push jogger suspect arrested
8.95713E+17,2017-08-10T18:25:02.000Z,https://t.co/gccoNpEUb7,"Egg scandal: 20 tonnes sold in Denmark, food agency says"
8.95719E+17,2017-08-10T18:49:44.000Z,https://t.co/rbKeu1Q2CR,"Trump to North Korea: Be very, very nervous"
8.9597E+17,2017-08-11T11:26:07.000Z,https://t.co/c4c9wkOiul,Eggs containing fipronil found in 15 EU countries and Hong Kong
8.95973E+17,2017-08-11T11:39:30.000Z,https://t.co/kBiVwMq5IP,Trump warns N Korea that US military is 'locked and loaded'
8.96007E+17,2017-08-11T13:53:54.000Z,https://t.co/oUj14CotLz,Egypt trains collide in Alexandria killing dozens
8.96088E+17,2017-08-11T19:17:01.000Z,https://t.co/Cd2hrdIlxH,Kenya election: Uhuru Kenyatta defeats Raila Odinga
8.9638E+17,2017-08-12T14:35:19.000Z,https://t.co/EZFpnxkjQn,Kenya election: Opposition vows to overturn 'sham' election
8.96394E+17,2017-08-12T15:31:08.000Z,https://t.co/qpaPixo5XX,Charlottesville: One killed in violence over US far-right rally
8.96456E+17,2017-08-12T19:39:19.000Z,https://t.co/VjWOAq5Har,"Relive GB's relay gold, Bolt's injury and Farah's silver - clips & text"
8.96726E+17,2017-08-13T13:30:46.000Z,https://t.co/OXTSGgNIBL,Scaramucci: White House plotters seeking Trump exit
8.96795E+17,2017-08-13T18:06:47.000Z,https://t.co/X9uv3WnOXW,Charlottesville: Trump criticised over response to far-right
8.96892E+17,2017-08-14T00:30:15.000Z,https://t.co/RbUcvQoYdv,Barnaby Joyce: NZ confirms Australian deputy PM is dual citizen
8.96916E+17,2017-08-14T02:05:58.000Z,https://t.co/b31zVaPCjh,Burkina Faso gun attack kills 18 people at cafe
8.97075E+17,2017-08-14T12:37:17.000Z,https://t.co/wHxFX4DAR3,Sierra Leone floods kill hundreds as mudslides bury houses
8.97106E+17,2017-08-14T14:41:13.000Z,https://t.co/7JktDzhte7,Charlottesville car-ram suspect James Alex Fields denied bail
